art,text,issue_name
0014,"THE  NATIONAL  REGISTER.  Tues,:ny,  A  pril  18.  Mr.  P.we,  alluaintr,  to  some  o!)Fervations  that  had  fallen  on  a  former  day  from  certain  Members  of  the  ifou  , STYLE=superscript  e,  and  to  an  opt opthlo  hlo opthlo  that  seemed  to  he  partially  entcrtained,,  that  the  manufac manufactares  tares manufactares  of  the  country  •  %yen•  on  the  tlecrealr,.oberved,  that  our  shipping  eltivlT;ea  to  the  diftl  , STYLE=superscript  rent  parts  of  America,  had  en encreasea  creasea encreasea  63,000  tons  doriwz  la,  t  year,  accottilug  to  a  statement  now  on  .:.table  of  the  Hou-e.  Mr.  s  e STYLE=superscript  -Moore  )I)4erved,  that  he  wa  - STYLE=superscript  s  not  pr-pareil  to  meet  orm  ilerano  on.  tl;  had  gtat  ea  for  thf.  prospet  ity  of  oar  titanuf•tetare.,  ly.:t  he  c.o;ltl  i;;fortn  him,  that  the  greater  part  e.);*  the  nvonifacturers  of  the  West  amt.  North  mere  half  stars  ing  with  their  families  for  want  of  employment.  SMITE;  ILIA)  11.11  1:T  r.  -  -  Fir  Charles  Pric  moved  the  order  of  the  day  for  the  second  reading  of  the  t;mithlield-Marizet  Rein;lv%l  Bill.  Mr.  Altleeman  Corube,  after  5  tatioc;  the  grounds  of  his  ohjec ohjectior.s  tior.s ohjectior.s  (a  the  measure,  moved  that  the  second  reading  be  post postpolled  polled postpolled  till  this  day  six  months.  .  Mr.  H.  Martin  seconded  the  amendment,  and  was  supported  by  'Mr.  Horner  and  Mr.  Lyttleton,  who  suggested  the  idea  of  two  mariiets.  Mr.  Ilutehin3on,  Mr.  Ponsatiby,  Mr.  Mellish,  Mr.  Fuller,  Mr.  Barham,  Mr.  Whitbread,  and  the  Attorney  Ceneral,  on  the  groutid'of  the  melsure  having  an  evident  ten tendent),  dent), tendent),  to  deteriorate  the  property  belonging  to  die  Orphan  Hos Hospital,  pital, Hospital,  and  all  the  private  property  in  the  vicinity  - STYLE=superscript  of  the  spot  1s  here  the  new  mar  ket  was  projeoed,  as  well  as  the  avenues  and  strtets  leading  to  it.  The  removal  of  the  market  from  Smith Smithfield  field Smithfield  v  nuld,  on  the  contrary,  render  property  less  valuable  also  in  triat  quarter.  Sir  Charter  Price,  Mr.  Rose,  and  Mr.  Alderman  Shaw,  sup supported  ported supported  the  Bill,  on  the  ground  of  the  necessity  of  removing  the  market  somewhere,  as  the  present  accommodatimr  was  by  no  means  adequate,  and  as,  from  the  crowded  state  • STYLE=superscript  of  the  market,  much  injury  was  sustained  by  the  cattle,  and  the  buyers  and  sellers  themselves  were  not  e  vein  pted  from  danger.  • STYLE=superscript  The'  ques.::  tion  being-  cacti  for,  thegallert  was  cleared;  but  the  amend  went  was  carded  without  a  division,  and  the  Bill  of  - STYLE=superscript  ceurte  . STYLE=superscript  thrown  out. ",0002644/1809//0423/0002644_18090423_mets.xml
0015,"IRIS!'  CURRENCY.  Mr.  Parnell,  pursuant  to  a  foroter  notice,  rose  to  suhtnit  a  motion  to  the  House,  for  a:lFimiloting  the  medium  i  f  FixeWurtie  between  this  country  a:tcl•  strired,•that  . STYLE=superscript  it  iikr4  intention  to  wove,  in  theAtesolutions  he  meant  Vi•liobifit‘  tO tOthe  the tOthe  Howe,  that,  in  order  to  a3similatc  thlf  currency  , STYLE=superscript  of  the  twikcountries,  and  facilitate  their  pecuniary  intercourse,  the  Batik  of  England  Notes  should  he  made  legal  tenderS  in  Irt;land,  •  as  well  as  those  of  the  Bank  o(  Ireland  ;  that  the  English  shilling  should  pass  for  twelve-peure,  and  .not  for  thirteen,-  as-  now  ;  and  that  the  copper  coin  of  Irelmtd  ou  dbe  called  ih,  and  'that  of  En4land  stihstituted  in  its  room.  The  motion  wa,  put  and  rejected  without  a  division.  Lord  Castlereagh  moved  the  order  of  the  day  for  the  House  resolving,  itself  into  a  Committee  on  the  Militia  Completion  Bill.  Mr.  Giles  expressed  his  conviction,  that  the  ballot  was  from  various  considerations,  the  most  expensive  and  partial  mode  of  raising  men.  But  at  any  rate,  he  must  contend,  that  the  intro introcluction  cluction introcluction  of  the  ballot  would  in  fact  dekroy  the  very  experiment  of  the  Noble  Lord.  2_  A  division  then  took  place,  when  there  appeared.—For  the  clause  52  1  Against  it  12  I  Majority  40.  Some  discussion  then  took  place  ou  tile  clause  imposing  a  fine  of  20t.  on  the  county  fur  every  man  not  raised.  A  division  then  took  places  and  the  numbers  were—For  the  Clause  31  1  Against  it  9  I  Majority  25.  Adjourned. ",0002644/1809//0423/0002644_18090423_mets.xml
0016,"APRIL  2  ,  ,  Wednesday,  Jpril  19.  •  BA  N  K  RIT  PT  LAWS.  Onlite  Clattse-forpermintte:  the  . STYLE=superscript  liaticrutit  'to  be  ft  - STYLE=superscript  Wittiest  after  he  has  received  his  certificate,  but  before  he  has  released  :113  allowance,  a=ir  - STYLE=superscript  Samuel  Romilly  propord  an  Amendment,  to  ofivihte  some  olj:tetions  which  he  'understood  Would  be  nia,de  to`  the  Clause,tthat  the  Poinkmtpt  in  a  casein  which  his  own  Assignees  are  the  claimants  ',tmid  be  rendered  ,t;  competent  Witness  o  n  giy giy.ing  .ing giy.ing  in  release  to  any  intert.-.t  ar6ing  out  of  t  hat  action  in  v.  hint  he  is  a  witness.  In  support  of  this  amenduient  it  wv.s  urged  by  Sir  S.  Hominy,  Mr.  Morris,  Mr.  Stake  - STYLE=superscript  it,  and  Sir  Charles  Price,  that,  - STYLE=superscript  as  the  law  now'  st4od,  the  la  of  evidence  were  violated  by  admittinz  an  interested  witness;  and  contended  on  the  other  hand  by  the  Attorney  and  Solicitor-General,  Mr.  Wilson  - STYLE=superscript  4nd  Daoirs  Gidov,  that  the  bankrupt  ?leasing  his  allowance  retured  him  a  competent  witness,  and  that  his  no nominal  minal nominal  interest,  if  any,  would  go  rather  to  affect  the  credit  than  the  competence  or  the  The  Clause,  as  anietulcd,was  allowed  to  stand  part  of  the  On  the  clause  granting  to  the  bankrupt  a  right  or  apral  to  the  ChanCellor,  in  case  said  bankrapt  was  refit:eds  a  certificate  by  four  fifths  of  his  creditors  in  uninher  awl  value,  a  long  con conyersatitin  yersatitin conyersatitin  took  place  between  Mr.  Steven  - STYLE=superscript  and  'the  Solicitor-,  Geueral.,  in  which  the  former  supported  the  - STYLE=superscript  cause  and  the  latter  oppos6l  it.  •  The  Ouse  was  put  and  agreed  to.  The  report  was  bronght  np,  ordered  to  be  taken  into  further  consideration  on  this  day  se'nnight,  and  to  be  printed;—Adjourned.  Thursday,  April,  20.  (tit  kitrT  OF  LAND  AT  CHELSEA  TO  COL.  GORDON.  11r.  HuAlsson  rose  for  the  purpose,  of  moving  that  there  he  laid  heffitte  the  House  some  Papers;  in  addition  to  those  order/A  on'  Friday  last,  relative  to  the  land  granted  at  Chelsea,  to  Colo.  nel  Gordon,  in  order  to  enable  the  House  to  judge  more  satis satisfactorily  factorily satisfactorily  of  the  nature  and  circumstances  of  that  transaction.  lie  had  already  in  a  former  debate-stated  that  the  coadition  of  the  grant  to  Col.  Gordon  was,  that  no  buildings  should  he  erect erected  ed erected  on  the  land  which  could  interfOre  with  Chelsea  floipital.  But  having  heard  in  that  instance  from  two  Hon.  Baronets  (Sir  Francis  atiltlett  and  Sit-Oswald  Wisely)  who  had  personally  surveyed'  the  ;eremises,  that  the  buildings  iacontemplation  would  interfere  with  the  Infirmary  of  the  Hospital,  he  thought  it  •  his  duty  to  go  the  next  day  to  inspect  the  ground  and  ascertain  that  fact.  On  inspection,  hedid  find  That  ;the  ereetionof  a  httildirg  !  in  the  situation  where  the.  foundation  was  preparing,  would  in interfere  terfere interfere  with  the  Infirmary,  and  consequently  would  he  a  viola violation,  tion, violation,  or  rather  a  departure  from  the  condition  of  the  grant.  in  .the  evening  he  communicated  this  circumstance  to  his  night  110.  nottrable  Friend  (the  Chiniellor  of  the  Eichequer),  and  begged  of  hi  t  n  to  juopeet-io  person  the  premises  ;  and  the.  con  s STYLE=superscript  eque  nce STYLE=superscript  was,  thisboainquiry,  it  was  . STYLE=superscript  foun#  that  the  person  who  had  taken  possession  of  the  land,  and  was  erayloyed  to  prepare  the  foundation  of  the  building,  bad  not  consulted  either  the  `;tar `;tarveystr-etteartl.  veystr-etteartl. `;tarveystr-etteartl.  of  OFown  40s,  .or  the  Surveyor  of  Chel,ea  :Lai4l,ooon  the  subject;  'l4  .inquiry  had  been  directed  in  writ writingtoAteSUrveyor-General  ingtoAteSUrveyor-General writingtoAteSUrveyor-General  of  Crown  [Awls,  and  in  consequence  ithe'  i  ttitpa  i  tfOu  tlf  ,the  foundation  for  the  building  had  been  altered;  SO  014  it  appealed  by  the  answer,  that  a  budding  on  the  no  w  intended  fonadation,  would  not,  in  th'e  Smallest  degree,  interfere  with  ;  the  Hospital.  The  papers  he  shouldinove  for,  were  copies  of  . STYLE=superscript  the  letters  of.  George  Harrison,  Esq.  to  the  Surveyor-i..ieneral  of  Crowe  Lands  upon  014°  suhject,  together  with  .  the  ani,wers  theretti.  He  should  also  move  for  a  copy  of  the  Report  of  the  two  Surveyors  who  valued  this,land  at  55/.  a-y.c4tte,  upon.  oath,  which  valuatioo  they  still  .conti STYLE=superscript  u  ued STYLE=superscript  to STYLE=superscript  think  adt'Nuate.  Whew  these  papets  should  be  before  the  House,  they  would  clearly  she,wahat  i  itwas  not  the  intention  of  the  Trca-u1)  to  grant  a  fa fayour,  your, fayour,  to  any  individual,  at  the  ex  pence  of  the  health  or  comfort  of  the  Invalids  of  the  Hospital.  He  concluded  by  movi moving  ng moving  that  these  Papers  be  laid  b  efor STYLE=superscript  e  the  House.  The  Papers  were  ordered,  and  Mr.  Huskisson  presented  them  from  the  Bar;  when  they  were  ordered  to  lie  on  tas  t  e  table,  ma.  to  bz  printed.  °  •  \‘•  GENERAL  CLAVERING.  Sri  Thomas  Turten,  in  rising  to  make  the  motion  of  which  he'  had  given  notice,  was  aware  of  the  difficulty  in  which  he  writs'  placed  by  the  late  prOceedings  in  that  House  respecting  General  Clavering.  If  he  were  nut  convinced  of  the  importance  of  the'  question,  not  only  Witte  justice  of  that  House,  but  to  theliberty  •  of  the  subject,  he  should  he.thelast.tuan  to  appeal  to  the  mag•-•  1 ",0002644/1809//0423/0002644_18090423_mets.xml
0017,"APRIL  2  narkimity  of  ParliamenWpr  claim•ito  indulgence  ;  for  a  proposition  for  al  tering  . STYLE=superscript  a  t)rmer  decision.:  In,dointthis  - STYLE=superscript  '  however,  he  was  solely  actuated  . STYLE=superscript  by  a  regied  to  ,  justice  , STYLE=superscript  and  for  the  diameter  of  1  that  House;  as  116  *Vac  IV  holly  unnt4tittinted  with  the  - STYLE=superscript  connect  inns..l  of  the  gallant  Officer  to  whose  case  - STYLE=superscript  he  was  to  refer.  The  Hun.  taronet  then  proceeded  to  state,  -that  if  ho  had  been  msent...at  the  discuydon,  he  should  have  employed  his  humble  ell'ofts,;  though  he  thirst  not  flatter  hini4elf  he  should  Gave  beett'sUccess beett'sUccessfill,  fill, beett'sUccessfill,  to  dissitade  the  House  from  the  decision  it  had  tome  to.  He  then  contended  that  prevarication  could  not  apply:to  the  evi evidence  dence evidence  given.by  that  Officer,  and  was  proceeding.to  an  examine•  don  of  the  evidence  in  the  printed  inintites,.  in  order  to  establish  that  point,  when  .  .  .  Mr.  Whitbread  called  the  Hop.  Baronet  to  order,  as  he  nn*  derstood  his-object  to  he  to  induce  the  House  to  reverse  a  solemn  decision  it  had  come  to  in  this,  Session,  in  the  same  Session,  which  was  contrary  to  the  usage  of  Parliament.  The  Speaker  was`of  the  same  opinion.—Sif  Thomas  Turton  accordingly  -withdrew  his  motion, ",0002644/1809//0423/0002644_18090423_mets.xml
0018,"BILL  TO  PREVENT  run  SALE  OF  PLACES.  Lord  Folkstone  had  a  few  words  to  say  on  the  subject.  He  observed  that  these  sort-sof  preventive  bills  very  rarely  did  any  good.  As  long  as  temptations  were  sufThred  to  remain,  offences  would  be  committed.  Notwithstanding.  the  provisions  of  such  bills,  the  ingenuity  a  offenders  would  continue  to.  evade  them,  at  a  little  more  ex  pence  or  trouble.  If  the  inquiry  he  had  pro proposed  posed proposed  a  few  nights  since  had  been  gone  into,  there  would  have  been  no  occasion  for  the  present  measure.  As  to  the  othces  con connected  nected connected  with  the  courts  of  law,  he  found  they  had  been  for  a  long  time  regularly  bought  and  sold,  but  he  could  no  reason  why  this  pr:ctice  should  he  suirored  to  continue.  There  was  another  Omission,  however,  in  the  act,  which  appeared  to  him  of  more  material  •  moment.  The  attention  of  the  House  had  been  much  fixed  to  Last  India  w•riterships  and  cadetships,  but  there  was  another  thing  of  much  more  consequence  which  had  not  been  noticed.  It  was  most  notorious  that  there  was  a  traffic  for  other  plAees.,  and  also  for  seats  in  Parliament.—(  Hear  !  hear  !)  This  was  a  thing  most  contrary  to  every  idea  of  the  constitution,  and  vet  it  was  most  notorious  ;  and  as  it  was  most  notoriotv,  -  be  thought  the  Right  [Linton:able  Gentleman  would  do  well  to  introduce  a  clause  in  his  bill  to  prevent  trafficking  for  seats  in  Parlia  , STYLE=superscript  aent.  The  Treasury  was  .the  place  where  this  traffic  went  on•  to  the  greatest  and  most  corrupt  extent.  The  Secre Secretary  tary Secretary  of  tire  Treasury  was  generally  the  agent  in  all  those  trans transactions  actions transactions  on  the  part  of  the  Government,  (  Ilear  !  hear  !  )  ciendetnen  meant  by  this  sneering  to  imply  at  doubt  of  hi-  state statetusat,  tusat, statetusat,  he  ,sktpuld  be  very  happy  to  he  allowed  a  committee  to  exatuitie  into  the  fact.  At  every  dissolution  of  oarliament  there  i%O.s  an  office  open  at  the  trensnry,  where'  the  friends  of  adminis administration  tration administration  stated  theft  terms,  and  where  persons  made  their  bargains  on  differeot  terms,  according  to  the  abilities  with  which  they  were  supposed  capable  of  stipporting  the  Government.  This  svnQitis  firm  belief,  anti  he  believed  it  was  also  the  belief  of  the  pantie..  thought  the  House  should  correct  abuses  of  this  tpagpitude  s  at.  the  same  time  that  they  were  - STYLE=superscript  passing  a  bill  with  respect  to  minor  offences.  Mr,  Creevey  said,  that  the  Noble.  Lord  was  perfectly  correct  in  stating,  that  - STYLE=superscript  seats-in  Parliatnent  had  been  notoriously  bought  and  sold-  by-  the  Treasury.  Ile  would  say,  that  this  - STYLE=superscript  vas  not  wily  Ms  belief,  hut  that  it:  was  within  his  knowledge.  The  Treasury  not  only  openly  bought  and  sold  those  seat,  but  the)  lievt  in  a  great  degree  the  monopoly  of  that  .market.  If  this  Ao,  attempted  to  be  denied  by  Ministers,  he  should  he  glad  to  have  the-opportunity  of  proving  it,  and  he  could  easily  prove  it  from  the  lips  of  any  one  who  had  ever  been  Secretary  of  the  Treasury.  It  was  absolute  -nonsense  and  delusion  On  the  public,  for  the  House  to  spend  their  time  in  considering  abuses  in  the  Commis Commissioners  sioners Commissioners  of  the  Lottery,  and  every  oilier  minor  department,  when  they  knew,  and  when  the  public  k'ww,  that  the  greatest  of  all  atuscs  was  constantly  practised  b)  every  Secretary  of  the  Treasury.  in  buying  and  selling  seats  in  Parliament.  To  talk  of  a  dissolution  of  Parliament  as  an  appeal  to  the  people  was  mere  mockery  and  imposition.  It  was  perfectly  well  known  that  a  dissolution  of  Parliament  was  not  tin  appeal  to  the  peo people,  ple, people,  but  to  the  Treasury  (Hear!  Rear  !)  Although  he  had  great  respect  tar  the  last  Goverment,  and  owed  some  personal  favours  to  them,  Set  he  must  say,  that  their  dissolution  of  Par Parliament  liament Parliament  at  the  end  of  four  years,  like  the  dissolution  by  the  present  Ministers,  at  the  end  of  about  four  months,  was  not  nn  appeal  to  the  people  but  to  the  Treasury  (loud  cries  of  Hear  !  Hear  !)  Until  tie  House  was  disposed  to  suppress  this  odious  and  unconstitutional  traffic,  the  legislating  on  those  .miaow  abuses  was  mere  mockery  and  delusion. ",0002644/1809//0423/0002644_18090423_mets.xml
0019,"THE  NATIONAL  REGISTER.  The  Chancellor  of  the  Exchequer  said,  he  was  happy  to  find  that  the  Noble  Lord  (Lord  Folkestone)  had  - STYLE=superscript  attributed  whatever'  there  wasof  obscurity  in  this  Bill,  to  the  derive  of  making  it  as  comprehensive  as  possible.  lie  was  also  glad  that  the  Nobla  Lord  had  admitted  that  the  Iiill•would  render  the  commission  of  thestoilences  more  difficult  in  future.  As  to  the  purchase  and•  sale.  of  places  connected  with  the  Courts  of  Justice,  that  had  prevailed  from  very  remote  times,  but  he  believed  that  it  woold  not  be  said  that  the  practice  at  all'interfered  with  the  levity  of  the  administration  of  ,justice.  As  to  what  hail  been  sugge:ted  with  respect  tothe  prevention  of  the  tratlie  for  seats  in  Parlia Parliament,  ment, Parliament,  this  would  be  a  matter  which  might  fairly  he  stated  when  the  Bill  should  come  into  a  Committee.  -  If  the  .Noble  •  Lord  or'  lion.  Gentleman  would  then  brine  lot  ward  any  proposiSton  of  that  sort,  the  house  would  be  vt‘ry  ready  to  take  it  into  their  consideration.  The  Noble  Lord  had  stated  his  firm  belief  of  the  existence  of  such  transactions,  and  the  lion.  Gentleman  had  gone  further,  and  stated,  that  it.  was  with  in  his  atisolute  knowledge.  The  lion.  Gentleman  to  be  sure,  might  have  some  , STYLE=superscript  knowleflgel  from  the  confidence  %s  tile!)  was  reposed  in  him  by  the  bite  Ad.  ministration,with  whom  lie  was  connected  Lead  cries  el  kyr  !  hear  !  )  Ile  could  not  recollect,  however,  that  that  Hon.  Gen Gentleman  tleman Gentleman  (Mr.  Creevey)  had,  at  the  tithe  when  a  specific  charge  wits  brought  against  a  Secretary  of  the  Treasury  for  such  inter interference  ference interference  given  the  House  the  beeelit  of  his  knowledge.  The  House  would  perceive,  'that  the  rest-  he  alluded  to  'iris  wfien  a  charge  was  brought  against  a  Seirteary  of  the  .Treasury  (Mr.  l'remantle)  for  interference  in  the  election  of  Ilempshire,  where  he  was  undoubtedly  a.freeholder.  T  he'll  on.  Gent!emanelil  not  then  tell  the  House  a  word  of  that  practice  which  was  within  hisown  knowledge,  of  S.•cretaries  of  the  Treesury  corruptly  in interfering  terfering interfering  in  the  election  of  Members  of  Padia:nent.  When  he  had  that  knowledge,  how  did  it  happen  that  his  patriotism  was  asleep  on  that  remarkable  occasion  ?—(  Heat:  !  hear  !)  If  he  would,  however,  then  bring  foreard  impartially  those  specific  cases  that  were  within  his  own  knowledge,  lie  would  probably  find  the  Ilouse  very  ready  to  attend  to  them.  Mr.  Whitby(  a  I  said,  that  he  wens  happy  that  the  suggestio:s  of  his  Noble  and  I  [on.  Friends  appeared  to  be  received  with  so  much  cordiality  by  the  Right  Hun.  Genthonan  (the  Chancellor  of  the  Exchequer),  and  that  it  seemed  to  he  admitted  that  the  practice  of  trafficking  for  seats  iu  Parliament  was  a  thing  which  ought  not  to  be  tolerated.  He  supposed  that  when  the  Rigll  lion.  Gentleman  (the  Chancellor  of  the  Exchequer)  called  upon  an  Hon.  Friend  of  his  (air.  Creevev),  to  bring  one  set  of  cases  before  the  Douse,  he  was  also  really  to  practise  that  impartia impartiality  lity impartiality  which  he  recommended,  and  brio;  forward  those  cases  which  were  within  his  knowledge.  (ticar  !  Hear!  )  It  was  nonsense.  to  pretend  to  he  ignerant  of  those  abuses.  What  Member  of  Parliament  was  there  that  djd  not  know  thatsuch•things  were  done  ?  '  Did  not  he  know,  did  tot  the  Right  hon.  Gentleman  know,  did  not  every  body  in  the  House  know',  that  there  were  many  Members  who  sat  there,  that  were  Representatives  of  nothing  but  their  own  money  ?  (  Loud  cri::&gt;  of  hear,  hcar,  /;.one  the  Opposition  I,e  nches  !  )  And  it  was  a4so  known  that  many  who  had  paid  their  money  cur  their  seat,:  shill  felt  themselves  depen dependent  dent dependent  on  other  men,  and  if  they  differed  from  them  felt  those  qualms  of  conscience  or  of  hoimur  which  made.  them  vacate  both  the  seat  and  the  meney  they  had  paid  for  it.  It  was  not  certainly  any  char  te  e'.  agaihst  the  present  Administratioi  .to  state  dp  e.:  thites  ,  for  the  charge  applied  as  well  to  him  and  to  other  Member  of  the  ilitesta  lang  known  that  those  things  were  done,  and  '  wc  t  newer  brought  it  forward  to  Parliament  in  a  proper  shape..  A  3  to  •the  case  of  the  Hampshire  election,  the  Right  Moo:treble.  Geetieman  (the  Chancellor  el  the  Es.chequer)  happened  ahout  that  time  to  a  very  short  pt:rtion  of  Ilk  lice,  to  be  in  a  Minaritse  He  (hlr.  Whitbread:  had  been  for  l  9  years,  generally  in  a  Minority,  and  theteforh  he'  was  very  apt  to  think  Minorities  right  ;  bat  the  Right  [lon.  Gentleman  ho  had  been  so  seldom  in  a  Minorite.  to  that  aloe  c,  should  rather  be  inclined  to  suspect  that  he  was  w  roue  when  headed  so  contrary  to  his  usual  prectice.  Without  however,  meaning  to  arraieu  any  particuler  Secretary  of  the  'treasury,  he  would  state  generally,  teat  under  the  present  system  all  Secretaries  of  the  Trensury  had  themselves  under  the  necessity  of  acting  iu  this  marmer,  and  there  is  always  an  open  market  at  the  Treasury  for  bargains  of  this  nature.  If,  however,  the  House  was  disposed  to  make  it  a  misdemeanour  to  trallic  for  East  India  Writerships  and  Cadetships,  they  should  certainly  take  some  notice  of  a  tralfe:  which  was  equally  as  notorices,  hut  more  scandalous  and  enconstitutihnal.  if  tire  itiabt  lion.:.'  emir  man  would  appeal  to  his  until:,  neiehbour  (  Lord  Castlereagh)  that  Noble  Lord  would  inform  him  that  iu  11  - STYLE=superscript  eta:id,  about  a  in  i  lion.and  a  half  had  been  paid  for  the  puichase  of  Boron  \ ",0002644/1809//0423/0002644_18090423_mets.xml
