art,text,issue_name
0026,"l'4 STYLE=superscript  Aff  MATIONALC  nuaz  Sinn.  ATM  111  1.1.  M  V  14.4  1 STYLE=superscript  4'  :;SR:Aa  '•  •  .4  . STYLE=superscript  4iiptfororthk;  Go9rPctflis  of  the  state  or  the  infantry  which  eugukrised,f,l  chat  ,4  Poctugab  pwrars  a  tbvis  were  etpfi'liflCed  1.  9,  40./  ca  - STYLE=superscript  pthini,  citli2elic'T,2S4'ser citli2elic'T,2S4'serjeants,T6Cldl4l4;ll6oo4,  jeants,T6Cldl4l4;ll6oo4, citli2elic'T,2S4'serjeants,T6Cldl4l4;ll6oo4,  40161trtarill  fikf--44114f1rsettlitied  131  field'  Alt  rfts  .- STYLE=superscript  .•  898icapbains,-1,109  ofllccni  t  s  l,ot  143  u  vnropsar.  ;:3-,1;,14,7,  •  !  caul:  and  tile,  leaving  a  deficiency  of  610412.ker5,,...V  4  .c!aptiains,  4?  subalterns,  11  stall  ofrieeLt  s  ,4o  strjeailis;  Sq  iliututners;  and  6,459.  111,e,„  This,  st4tAkn.W4  .  of  deficiencies  include's  - STYLE=superscript  abbot  ; STYLE=superscript  4&amp;/`  Drifisfi  li STYLE=superscript  s  6 STYLE=superscript  fdierl;  bad'  prisoners  . STYLE=superscript  by  the  - STYLE=superscript  enenvy,bbot..aftierwardi  ;released.'by.:the  GallicianS,  and  were  on:theitivilsyfto  Lisbon.-  •  By  the  return  'af  the  rovalcattiliety!ernuarked,  it,  appears  that  there  have  been  embarked  100(ufficers,  271  non-coin-  ruissioned  ofticers,'l,si  'atraners,  deurrimei•R,..roaking  total  of  '2,255.  Of  the,  r)yal  artillerrdrivorsv;tbete:  were  16  officens„:  118  t•;4o3ldriverst  16  trumpeters,  132  .a  gene  e  ral  tota4  f3;4139.  Of  these  .tlitre-  remained  •:in.  Por!tqg'alf  by  the  lastireturns,  w  they  were  kilt:led  in  thit,counissr,voi  royal  artillery  . STYLE=superscript  9.5  sydieers,  non.ronunislioned  officers;  1011  gunners,  27  drummers.  Of  artillery  -ciri  v  •  46,0  f.  faxes,  112  •nom-cominissiiined  .officers,  drivers?,  16  trumpeters,  .125  artificers,  making,  a  qeneral  total  of  3,159.  i  (Iv  Y'S  LedVIJOA  G  .1$  'ETT  .  .  ~~~1.  .  .  ',,,::•-,•,  :  :  ,  ~.  .•  p4.NliCitlifvflOr.l4X,l,.4B,l;h4„.7  ;  !;,-t;,...,.,  .•  .1011.7,1  cr.onGF:,  of  C.arburtou-street,  Viti.rov7iipiatc.,,-)Xiditie€!!xt  hPrsi.  ll STYLE=superscript  dealei4Voin  Aptil,LS,  to  dur43,  at  ten,  at  Guirdhilf:'  '  '  •  -.  7 STYLE=superscript  :  '  .  '  .•  .  ',  P  ii‘)..vordrts.  .  .  .  Tilsom  AS  lIITILL,  Bath,  carriers  to-surrender,  A)lirilAA,  411  f  trad  Nay  30,  at  aletveit,•at  the  Hittploant  and  Gaftkiißtb......,sattorntesfiterTsAiliftl4l  s  andfliortort,  Cranc-coitrt,  Fleet-street  ;  and  Mr.,Maut,  Bath.  .  .  ,  i  ,  Rt  CH  I  Itri  tq'tlL  SAIEIt;  Pet:ei  - STYLE=superscript  s•riiiirt,  Middle,'  tetdptyttione!--Scricener,  April'  '..rii  sit  eleVen,  May  2,  and  (10,'  at  test:  at  einildludle.  16111nenietoMessrs.  BlakoineWaiut  Mack  illtitill  e  Elm-court,  'Feutple..  1,  LI  ~  •  ,  i  DIINCOMB  PI  EIKE,  Bisliop44ate-trek,,httter;*  N0T197  afiy  13;  and  30,  at  twelve,  at  Guildhall.  Attorney,  M.  Cobte4Auktit  4 STYLE=superscript  •  '  '  .'  i•  'le  l•  JAMES  PON  NELLY,,Greek-street,  Soli  t  f  t  adlliarajeolwil  45,.  le  ,t  „,  at  twelve,  and  .30,  at  te.n,  at  Guildhall.  .Attorney,  Ntr.Cunlinglials!,  .1.%  e\y  ertli-,  'I  .  stret;  Ri4l  Lion-  aqua  re.  '  .;  S  11t  A  II  RATIIHONE.BROTHEft-  4 STYLE=superscript  ;,.  Sim  jughlaraOr  ilt`4  lo STYLE=superscript  9,  at  two  ?  and:  0,,  at  eleven,  at  thg  N.l.3tite  Itart  hui,.llrptia4bni.  l  atgliyaiai  l  !Ali.C:m‘table,  ynioncra  bin,  ChaliteiSclanel  and  Mr.'  Itneft,Thilt-IriiP  r STYLE=superscript  i  „  tlei•  mintiltaln.  ,  •!T  t  c.,  ,  ~  A  - STYLE=superscript  11,•,  ,i:'  !.  ,  - STYLE=superscript  ..e  1j  . STYLE=superscript  ..  •  PIIILip  IsioßßlSijAvtrpooll  i  rannifiefrehant,.  April  C1  .  9  .  ,.:May  I  t  anAda,  A  ore,  at  finildhall,  London.  Atturit'ey,_  . STYLE=superscript  'Mi.  MiiiikualT,'  V.  araielc-iiinare,  'News  gat;eillreet.  •  I  0  i,  ,5,.7it.,L311i  •il;  ;.•)*  -  JACA/13  NEALE,  ChiswelVeaketitl•PiPlu.sex*.yrik.A.E-::31i.  tI91:  pod  Ttas  SO,  at  eleven,  at  Guildhall.  .  Attoeue)  ?  .  ?Ir.  arlolo,,,ltedergtilatreeti  Ciipplente.  •  '  '  '  •  '  -  .  •  WILLIAM  SIIEMILL,  Burtr-street;  WWII&amp;  tifilleroAlPtill  2 STYLE=superscript  4,  29,  gra  d  'ill  ay  .  xi.  44.0ve,,  at.  (ittililhall.  At  Lomita,  ..`.le  7  isci.  litutpryi  T  ifrom,  lin;  Ince,  tira,);s tira,);s-im.il!A  im.il!A tira,);s-im.il!A STYLE=superscript  C:llol4B&#34;MPF:APYllNinEf'r'B'filtirOln'l'74P.baltn'.4l.  and  SA  - STYLE=superscript  11  . STYLE=superscript  A  - STYLE=superscript  11.1r/fPIII6IOIES  BRO  . STYLE=superscript  1141441t8;  Biptiwit*4  Apripii,gp,  ond.bi4y  30,  nt  :  ttin  l  at  GuikliHi  t  hontlon.  Attornie....,  evlro  — STYLE=superscript  h,  .  4, STYLE=superscript  row  il  40  I  lan  ord,  T  ai  nplc;  and  Mi.  V.l)kuiL..,toit,  Hickingliank.  •  .  •  .  P  •  Div  ti)END  , STYLE=superscript  I.  -  •  .  4 STYLE=superscript  *  .  ;110  I.:W4llltim  Cie*,  Lt  41  dvevot  one,  at  W  1141.110,  London.  •  I  ,raly,ll!Wittlaits  Close  pad  11%tibew  Clete,  Leedleolier,4  at  04v,  at  Guildhall  Londoi,.  :ItiV  'PI  'Joseph  Pipet  iligilth4M6-‘Ntintler,•ltielitho;ul;  grorel  ,  at  elr-..ca,  at,  Guildhall.  ,  1  II:1:'1%.f  I  ..  •  •  I'.  •  •  •,..  •  ,  July  4:9..  Knowles  Wittdoe;  nichnum(l,  vorer,  at  eleveu,  atl.tir  t  it  e  June  3.  ',AtAaloin  Marsh,  :11il!4.te,  LoildOn,jeweltee,  at  one,  4t  - STYLE=superscript  d  an.  ;*4'  .'  M  ty  ff..  John  Pitrtoir4  i  rlielfe;itle,  Avapoliotiskni  in  it  esi/he,  'at  failikl}:afl.  -,  '  g  Illay  .12.  Nicholas.  Barry  *  Liv.erptkil,  .flierchant,,,at  ta  Abe,  at  the  Goortsyslo,  Daie  7  street,  - STYLE=superscript  Liverpool.  i  •  Mn  '%  17.  NVidter  EWer,  Little  fahve4arte,  Aldertkanbury,  ,  merchant{  4t  4 STYLE=superscript  teh;  at  Guildhalls  •  ...  i  .  .  ...V.  ; STYLE=superscript  ..  4  /...  .June  6.  John  Somerville,  Chanrcrl.-lane,,cablnet-maker,  at.  one,  at  GA14144,.  July  1.  Jain'  Ty  rrell,  Maid  , STYLE=superscript  trine,  ironrnon•z•er,  at  one,  at  V  ;liilithall.  Tint/lon.  June  1.  John  Llst,  Brighton,  hander,  at  etevea,  at  Guildhall,  Lluilon.  :  .  June  3.  David.Glnver,  tititter-lane  l  Loudon,  auerd.ant,  at  twcht,  at  Guild Guildhall.  hall. Guildhall.  Jane  3.  Barnahtei  It  itterbee,  King's  Lynn,  Norlblk,  habeodaslnir,  at  twelve,  at  finildhall,  London  •  51ay  21.  Frederick  NA'illats,  Brewor-street,„Golden-sinarc,  elieesi;atong'er,  at  tell,  at  Guildhall.  May  90.  Nicholas  Humphre  y  s,  ShaNditeh,  Ilnen-drapevilt4rn,  at  I;.iildhalt.  May  9.  .bunei;  Taylor,  Luna;.,-Conduit-)street,  Mitldlelea,  apothecary,  at  oae,  at  (;uildhall.  May  11t.  Jog.oph  !flint,  Lif.  - STYLE=superscript  irpool,  haberdasher,  at  *OAT'S',  at  the  St  g  and  Gara  ter,  Paradi,e-it  reef  .  I.Averpool.  .  .  .  May  LI.  Greor!e•Jone  , STYLE=superscript  .  Liverpool,  booksteller,  at  one,  at  the  Star  anti  tarter,  Paradise-Atreet,  Liverpool.  CEIITIFICATEt--111A  V.9..&#34;.1,•'  •  James  Marrint.  Burnley,  L  . STYLE=superscript  lneaster.  cotton.spinivar—Thtimadl\aylorNiiiii.  beta.  of  Livorpool,  u  phol-terer  --Thaims  Duke=,  )litelifr-nigimal  i  -Jipp!iceput  %Vill•  Vowley,  Pearith,  Cuinberiand,  iron  MIA  ig  ef  -  AV  Wield  Affar,  Utaltdot-et  Met,  slicrenraker--SAnwel  16110,  %Varying,  breAer.  4  44 STYLE=superscript  1  .1 ",0002644/1809//0423/0002644_18090423_mets.xml
0028,"THE  NATIONAL  REGISTER.  1.4  guns,  Capt.  Fouvau—On  shore  under  Madame.  Tnunerre,  74  goes,  Capt.  Clement  de  la  Itouciere—Nine  months  old,  never  at  sea.  Ago  ilon,  71  gnos,  Capt.  Maingon—Old.  Ville  de  Var Varsovie,  sovie, Varsovie,  SO  gliw,  Capt,  —.  Calcutta,  36  gout,  Captain  La  Tooie—Loaded  with  flour  and  military  stol  Fit  IC  AT  ES  Captain  Protean.—On  shore  near  Fle  d'Enot,  on  her  beam  ends.  Elbe,  Captain  etren  g  ier.  Captain  Le  Bigot.  liortonse,  Captain  Allgaud.  N.  B.  One  of  the  three  last  frigates  on  shore  under  Isle  Ma Madame.  dame. Madame.  Return  of  the  NAMES  of  (lyric:ens,  SEAMEN,  and  MARINES,  killed,  wounded,  and  missing,  belonging  to  the  fleet  under  the  Command  of  Admiral  the.  Right  lion.  hoed  GA  matEA  ,  Com Commander  mander Commander  in  Chief,  between  the  11th  and  14th  of  -April,  1809,  ,  inclusivet  CA  LEDO  NI  A.—Mr.  Edward  Fairfax,  Master  of  the  'Peet  ;  contusion  of  the  hip.  Flintoft,  acting  Lieutenant,  Tho Thomas  mas Thomas  Maddox,  able  ditto  ;  John  Nelson,  able  ditto  ;  John  Ellis  (9d).  able,  missing,  and  suppnsed  to  he  drownevlo  TliESEUs.—Richard  Francis  jewers,  Master's  Mate,  severely  wounded  in  the  head  and  hands  by  pow  der  in  the  fire-ship  ;  John  Podney,  marine,  wounded  in  the  scrotum  ;  Thoma  4  boy  wounded  in  the  head  and  arm.  I  ermit  attsr..—Henry  Crookman,  Captain  of  the•foreeastle,  killed;  Peter  Derouk,  Boatswain's  Mate,  ditto  ;  John  Margo  4  vick,  seaman,  ditto  ;•  James  Mason,  seamen,  severely'  wnundett;  John  Solomon,  Seaman,  slightly  wounded;  Mr.  GilbritT  Suir Suirgerm's  germ's Suirgerm's  Assistant  ditto;  Mr,Marsden,  Purser,  ditto  ;  Joll6oiiidon,  seaman,  ditto  ;  John  Sheridan,  seaman.  ditto  :  John  seaman,  ditto  ;  John  Wheelan,  seaman,  ditto  ;  Matthew  C:ond,  seaman,  ditto;  William  Meuclienton,  marine,  ditto;  John  Budd,  marine,  ditto,  REVENGE.  ••---  Henry  Johnson,  landmnn,  killed  ;  TfttLuCtan-.'  mer,  marine,  ditto;  Thomas  Pessey,  marine  bny,  ditto  .4'  Tonics  Garland,  lieutenant.  severe  contusion  of  the  shoulder  and  side  ;  James  Cooke  (1),  ordinary,  left  thigh  amputated,  and  a  very  dangerous  wound  of  the  right  font  ;  Thomas  Whittock,  land landman,  man, landman,  w  mind  in  the  brad  ;  Thomas  Tyler,  landman,  wound  of  the  I  e  ;  Denis  Grey,  ordinary,  riontusion  of  back;  Thatnas•Trig Thatnas•Trigworth,  worth, Thatnas•Trigworth,  ordinary,  contusion  and  worind  of  right  foot  ;  Charles  Chew,  marine,  right  thigh  amputated,  and  a  very  dangerouvand  extensive  wnnnd  on  left  leg  and  thigh  ;  Thomas  Berry,  marine,  contusion  of  thigh  ;  .Tithn  W  'Fenian,  marine,  contusion  of  shout-,  der;  Timothy  Pato,  marine,  contusion  of  thigh  ;  Gen.  Skell  3,  marine,  coniusimi  of  shoulder;  Joseph  Weeks,  marine  tiny,  wound  of  thigh  and  contusion  of  hack  :  John  Carper.  marine,  contusion  of  bead  and  arm  ;  James  Irtighes,  corporal  of  Ind-,  ries.  contusion  of  back  ;  John  Ward,  contusion  of  arm.  MED  ATO  n.—James  Segge.FS,  gunner,  killed  ;  James  Wei*.  dridge,  captaio,  eery  winch  burnt  ;  Nicholas  Brent  Clement?,  lieuten:int,  slightly  burnt;  James  Pearl,  lieutenant,  ditto  . STYLE=superscript  ;  Mi Michael  chael Michael  Gibson,  seaman,  ditto.  N.  B.  The  last  four  blown  out  of  the  Mediator  after  she  was  set  on  fire.  tin  A  T.TAR.  John  Conyers,  master's-mate,  very  badly  scorched  in  tlw  fare.  and  hands.  Total.  —  officers,  8  men,  killed  :  9  ()liken,  26  men  wounded  ;  1  man  mitiaing.---Total  46.  GA  MIII  ER.  Reeeived  Finee  the  above  was  written:  BE  .4  cu.r..—Janes  Sutherland,  seaman,  wounded.  .TN  A.—Rich.  W.  Charston,  midshipman.  slightly  wounded.  APRIL  23.  am  sorry  to  say,  that  1  raeived  a  severe  wound  in  the  shoulder  by  a  grape  sh.et,  w  hie'',  obliged  me  to  to  quit  the  deck  z  however.  tl:e  ser,ice  did  not  sutler  by  that  event,  as  the  suc suc(eNling  (eNling suc(eNling  lieutenant,  the  Non  George  Douglas  fought  the  ship  through  the  action,  in  a  most  gallant  meeker,  which  continued  about  one  hour  and  thirty-five  minutes.  The  ~enemy  having  f  am  the  beginning  pointed  their  guns  high,  we  were  by  this  time  a  complete  wreck  in  our  limits,  sails,  and  rigging.  Notwith Notwithstanding  standing Notwithstanding  the  situation-  thv  enemy  .was  then  reduced  to,  she  tried  to  effeet  her  escape,  which  1  knew  was  totally  impossible  from  the  state  of  her  .  riggitsg,  and  more  particularly  as  at  that  time  the  Superieur  (the  brig  1  before  mentioued)  hailed  us,  and  gave  us  information  that  the  strange  sail  ,inst  seen  to  leewatd  was  the  Lamina.  On  tho  Latona'b  coming  within  gunshot  of  the  eller  my  and  given  her  a  frvr  guns,  :Othich  she  returned,  and  slightly  wounded  a  L  few  of  the  Latpua's  men  she  i  mmediatel STYLE=superscript  y  brou STYLE=superscript  g  ht STYLE=superscript  to  on  the  starbuard  tack,  and  every  mast  went  by  the  board.  Site  proied  to  be  the  French  Frigate  La  3  unon,  of  41  guns,  and  $23  men,  commanded  by  Monsieur  Augustin  RosEeou,  a  Member  of  the  . STYLE=superscript  Cegion  of  Hononr;  out  from  the  Saints  only  four  days,  bound  to  France.  I  now  ' STYLE=superscript  detail  the  loss  sad  damages  sustained  by  his  Majesty's  ship  under,  my  comtPand.  The  Horatio  has  s  u  ffered.  but  little  in  her  'hull,  from  the  rea reason  son reason  already  given,  of  ,  the  enemy's  aiming  particularly  a,t  nur  masts  and  rigging,.  which  they  effected,  having  nothing  else  standing  hut  our  lower  Masts,  much  wounded,  and  completely  dismaraled,  all  to  our  foresail,  and  the  rags  of  our  mainsail.  the  number  of  officers,  seamen,  and  marines  lost  on  this  (Kea (Keasinn  sinn (Keasinn  to  *their  country  and  their  riends,  are  by  no  means  consi consideta'Sle,,  deta'Sle,, consideta'Sle,,  when  compared  with  the  dreadful  loss  or  the  enemy,  shall  hereafter  relate.  The  loss  on  hoard  the  Iloratia  consists  of  ;lir.  George  Grunter,  midshipman,  awl  six  seamen  killed;  Mr.  Andrew.  Lock,  boatswain,  and  twelve  *seaman,  badly  wounded  ;  Lieutenant  Richard  DlakeneY,  of  the  110,Y  11 STYLE=superscript  Marines,  Mr..  Robert  King,  waster's  - STYLE=superscript  ma  le, STYLE=superscript  six STYLE=superscript  seamen,  mat  two.  marines,  ,slightfy  wounded.  The  loss  of  tFe  enemy,  as  I  have  before  stated,  was  all  her  lower  mast  ;  her  hull  most  is  on onderfaily.  derfaily. onderfaily.  cut  up,  making,  in  consequence,  a  great  deal  of  watery wateryuntil  until wateryuntil  the  - STYLE=superscript  shot-holes  were  stopped.  The  loss  in  killed  and  wounded  amounted  to  one  hundred  and  thirty.  The  Captain  expired  soon  after  the  action  from  the  wounds  he  received.  The  gallantry  :end  good  conduct  oftheofficeis  awl  ship's  com com.  . com.  pany  under  my  command,  I  must  always  remember  w  ith  grati gratitude,  tude, gratitude,  and  were  I  to  enter  into  particulars  it  would  be  endless.  To  Captain  Ferrie,..,yrho  commands  the  brig  Superieur  (one  of  Sir  Alexander  Cochrane's.  squadron),  1  feel  much  indebted  for  the  very  gallant  manner  he  Behaved,  although  I  believe  he.  had  only  four  small  commades  on  board  ;  and  to  Captain  Pigot  of  the  Latnna  I  shall  ever  - STYLE=superscript  feel  thankful  for  his  exertions  and,  activity  in  erecting  jury  masts,;  difi  l  and  putting  th  e  priwe  iu  a  4  --  sea  worthy  state.  T  have  much  pleasure  . STYLE=superscript  in  informing  you  that  the  Junon  ap appears  pears appears  a  very  fine  -ship,  a  i  nly  three  years  old,  never  having  been  at  sea  before  'she  left  France,  about  three  mouths  ago.  I  have  the  honour  to  be,  &amp;v.,  (Signed)  0.  SCOTT.  Right  Hon.  Sir‘J.  B.  Warm),  Bart.  and  K.  B.  Commanderia  Chief,  &amp;c.  &amp;e.  &amp;c.  A  list  of  the  killed  and  wounWed  on  board  his  Majesty's  ships.  Horatio,  Latona,  and  Driver,  in  action  with  the  French  lei leigate  gate leigate  La  'futon,  on  the  10th  day  of  February,  1509.  HORATlO—Killed—Mr.  George  Gunter,  midshipman;  James.  Adman,  captain  of  the  foretop;  Charles  Chatterton,  able  ;  Robert  Lawder,  able;  Joseph  Williams,  able;  Samuel  John Johnson,  son, Johnson,  ordinary  ;  and  Francis  Miek,  boy.  Badly  wounded—George  Scott,  captain  ;  Manley  Hall  T)ixon,  lieutenant;  Andrew  Lock,  boatswain  ;  S  callow  Stone,  cox  , STYLE=superscript  swain;  John  Ellison,  quarter-master;  Thomas  Jones,  quarter quartergunner  gunner quartergunner  ;  John  Young,  able  ;  Charles  Brittain,  able  ;  Peter  Vaughan.  able  ;  Thomas  Korkham,  able  ;  Edward  Lin  . STYLE=superscript  ,(l,  nble  ;  Thomas  Allen,  ordinary;  John  Palmirt,  ordinary  ;  John  Mil  ler,  ordinary  ;  Thomas  Nead,  ordinary;  James  barton,  ordi ordinary  nary ordinary  ;  Lew  Vanderstain,  ordinary.  Slightly  wounded—Richard  Blakeney,  first  lienteaa.at  of  royal  mirines  ;  Robert  K  ing,  master's  mate  ;  Boyd,  quar quarter  ter quarter  master's  mate  •  James  .%ightiugale,  able  ;  Henry  Cailsted,  able  ;  WilliaM  johns,  ordinary  ;  Michael  Molley,  ordinary  Joseph  Shore,  marine;  Thomas  Young,  drummer.  1,  4.  TO  N  A—Slightly  wounded—Mr.  Hoop,  midshipman  ;  A.  Hayes,  seaman;  .  3.  Arrogan,  seaman.,  D.  Wright,  seaman  ;  J.  Murphy,  seaman;:  J.  Anson,  seaman.  •  Daly  a—Thomas  Colville,  wantan;  b  idly  wounded.  (Signed)  G.  SCOTT. ",0002644/1809//0423/0002644_18090423_mets.xml
0029,"5.111  r STYLE=superscript  R  DA  I&#34;'S  LONDON  GdZETTE.  Admiralty  Office,  April  22,  LSOI.  His  Majesty's  Ship  Horatio,  Feb.  19,  ISO  9.  SIR—T  have  the  honour  to  acquaint  you,  that,  in  performing  erAers  in  the  morning  of  the  10th  instant,  in  Eat  19  50  N.  Long,  033  30  W.  standing  in  the  larboard  tack,  ship's  head  south  and  by  east,  the  Driver  sloop  of  war  under  my  orders,  abont  fifteen  or  sixteen  miles  nearly  astern, STYLE=superscript  at STYLE=superscript  half-past  ten,  A.M.  saw  a  sail,  on  our  lee  how,  and  shortly  afterwards  another.  In  the  0  0r  , STYLE=superscript  .e  of  an  hour  we  dibcovered  the  lee  one  evidently  t.  be  an  enemy's  frigate,  and  the  other  one  I  took  to  be  an  English  brig  of  war  dogging  her.  The  enemy's  frigate  en  making  us  out  bore  right  up  before  the  wind  for  a  short  time,.  but  very  pion  hauled  up  again.  At  three-tioarters  past  twelve  we  met  upon  different  tact',  and  come  to  close  action,  the  Horatio  wearing  under  the  enemy's  stern  .o  get  upon  the  same  tack  with  her.  In  the  early  part  of  the  the  country  lost  the  services  of  the  tirst  lieutenant  ;Intl  Dixon,  beinghadly  wounded.  and  not  long  after,  P12_TB00009 Al  as  P12_TB00010 J4ll  P12_TB00011 Ai  ;311  P12_TB00012 al  tl  L ",0002644/1809//0423/0002644_18090423_mets.xml
0030,APRIL  23.' ,0002644/1809//0423/0002644_18090423_mets.xml
0031,"THE  NATIONAL  REGISTER;  BANKRUPTCY  ENLARGED.  James  Brace,  Butt-lane,  Deptford,  dealer,  from  April  22,  to  June  10,  at  ten,  at  Guildhall,  London.  RANKRUPTS.  Richard  Heath,  Throgmorton-street,  merchant,  to  surrender  April  4,  May  6,  and  June  S,  at  one,  at  Guildhall.  Attorney,  Nr.  Adams,  Old  jewrv.  John  W  illson,  Beak-street,  Golden-square,  man's-mercer,  April  1 STYLE=superscript  25,  May  6,  and  June  3,  at  twelve,  at  Guildhall.  Attorney,  Mr.  Dixon,  Nassau-street,  Soho.  Edward  Empsom,  Bowling-street,  Westminster,  victualler,  April  2.5,  May  3,  and  June  3,  at  ten,  at  Guildhall.  Attorney,  Mr.-Shepherd,  Hyde-street,  Bloomsbury.  John  Andrews,  Manchester,  innkeeper,  May  1,8,  and  June  3,  ;  4  t  two,  at  the  Palace  inn,  Manchester.  Attornies,  Messrs.  Cooper  and  Lowe,  Southampton-buildings,  London  ;  and  Mr.  Jepson,  I::.4llcitester.  Diinson,  Lancaster,  woollen-draper,  May  15,  at  five,  :111.13i01e  3,  at  eleven,  at  the  King's  Arms  Inn,  Lancaster.  A  vorilics,  :llesttr.  Wakelock  and  Makinsim,  Temple,  Louden;  .  -  and  Mr.  Atkinson,  Lancaster.  Joseph  Wal:ier,  Est  Ardslee,  York,  malster,  May  25,  26,  and  JUN('  3,  at  eleven,  at  the  Elephant  and  Castle,  York.  At Attornies,  tornies, Attornies,  Mr.  Seymour,  York  ;  and  Mr.  Smith,  Middle  Temple,  London.  Redshaw  Spring,  Caistor,  Lincoln,  mercer,  May  11,  12,  and  :tune  3,  at  elevea,  at  the  George  Inn,  Caistor.  Attornies,  Mr.  .Nicholson,  Louth  ;  and  Messrs.  Leith  and  Mason,  New  Bridge Bridgestreet,  street, Bridgestreet,  Loudon.  Pawlett,  Great  Windmill-street,  Middlesex,  victu victualler,  aller, victualler,  April  24,  at  twelve,  May  1,  at  one,  and  J  one  3,  at  ten,  at  Guildhall.  Attorney.  Mr.  Crosse„  New-Inn.  Thomas  Wilt,  Shaft's-court,  London,  dealer,  April  24,  at  twelve,  May  I,  at  ot.e,  and  Juael,  at  ten,  at  Guildhall.  Attor Attornies,  nies, Attornies,  Messrs.  Bat  her  and  Cranch,  Union-court,  Broad-street.  Peter  Jackson,  Manchester,  small-ware-manufacturer,May  6,  6,  and  Juue  3,  at  ten,  at  the  Star  Inn,  Deansgate,  Manchester.  Attornies,  Messrs.  Cooper  and  Lowe,  Southampton-buildings,  London;  and  Mr.  Cooke,  Salford,  Lancaster.  John  Parsons,  sen.  bn:l  John  Parsons,  jun.  Ludgate-hill,  book booksellers,  sellers, booksellers,  April  29,  May  6,  and  June  3,  at  one,  at  Guildhall.  At Attorney.  torney. Attorney.  Mr.  Glenn,  Garlick-hill,  Bow-lane.  •  Titamas  Adam.,  Iligh-street,  Borough,  inuholder,  April  '29,  May  2,  and  June  3,  at  ten,  at  Guildhall.  Attorney,  Mr.  Law Lawrence  rence Lawrence  Williams,  Cuesitor-street,  Chancery-lane.  Joseph  Cooper,  Irlams  o'th'  Eight.  Lancaster,  victualler,  May  1,2,  and  J  tine  3,  at  two,  at  the  Dog  Tavern,  Deansgate,  Manchester.  Atto.nies,  Messrs.  Foulkes  and  Creswell,  Man-  •  chester  ;  and  ssrs.  Foulkes  and  Longdile,  Gray's  Inn,  Loudon.  Joseph  Mordue,  Wall's-End,  Northumberland,  ship-owner,  April  25,  at  twelve,  Nlay  15,  and  June  3,  at  eleven,  at  the  George  Tavern,  North  Shields.  Attoruies,  Mr.  Fenw  kit,  North  Shields;  and  Me-srs.  Meggison,  Hatton-garden,  London.  Walter  Price,  Cardiff,  Glamorganshire,  shopkeeper,  May  5,  6,:m1  June  3,  at  the  Rummer  'raven!,  All  Saints'-lane,  Bristol.  ktoraie  , STYLE=superscript  ,  Mr.  Stepticus,  Bristol  ;  and  Mr.  Sweet,  King's  Bench  Walks,  Temple.  Oliver  Newcombe,  Holles-street,  St.  Mary-le-Bone,  uphal uphalsterer,  sterer, uphalsterer,  April  4,  May  2,  and  June  3,  at  teu,  at  Guildhall.  At Attorney,  torney, Attorney,  Mr.  Allen,  Carlisle  street,  Soho-square.  Abraham  Low,  Iloston,  Middlesex,  builder,  April  25,  May  6.  and  June  3,  at  one,  at  Guildhall.  Attornies,  Mr.  Alfred,  thapeLstreet,  Pentonville  ;  and  Mr.  Burn,  Colemaa  street.  Sophia  Ilenshall,  Newman-street,  Oxford  Road,  shopkeeper,  April  Y  5,  May  2,  at  eleven,  and  Ante  t,  at  ten,  at  Guildhall.  Attorney,  Mr.  Stokes,  Golden-square.  William  Gillespie,  Basinghall-street,  tailor,  April  29,  May  2,  1  and  June  3,  at  twelve,  at  Guildhall.  Attornies,  Messrs.  Van Vandercoua  dercoua Vandercoua  and  Comp',  Bush-lane,  Cannon-street.  James  Laton,  Godstone,  Surrey,  farmer,  April  29,  May  6,  and  J  nue  3,  at  twelve,  at  Guildhall.  Attornies,  Mr.  Dyne,  Serjeanes  Inn,  Fleet-street;  and  Mr.  Drummond,  Croydon.  Thomas  Ward,  Kingston-upon-Hull,  merchant,  May  5,6,  aqd  Jane  :,  ateleven,  at  the  Cieorge  Inn,Kingston-upon-I  I  ull.  At Attornies,  tornies, Attornies,  Messrs.  Rosser  and  ion,  Barrietes-buildings,  Holborn.  David  Mews,  Bangor,  carunrvonsbirc,  druggist,  April  24,  95,  and  June  3,  at  eleven,  at  Wakeman's  Hotel,  Caratirvon.  Attoroies,  Mr.  Edmunds,  Lincoln  lun  ;  and  Mr.  Ellis,  PHlleli,  C.triert  vonslilie.  Thomas  Ashton,  Stamford,  Lincolnshire,  linen-draper,  May  19,  ane.  June  3.  at  eleven,  at  the  George  Inn,  St.  Martins  titArnford  Baron.  Att  Mespra.  Jackson  And  Jude,  Slaw Slawford.  ford. Slawford. ",0002644/1809//0423/0002644_18090423_mets.xml
