art,text,issue_name
0001,THE  . ,0002644/1809//0423/0002644_18090423_mets.xml
0002,"No.  69.  NATIONAL  REGISTER.  -t  ,  4  ,  t  .  •  .ur  tuna;  can:  tttution,  anb.Lazg.  •  PRICE  9d.  been  in  chief  part  occasioned  by  !this  origin,  much  inure  w,  indeed,  'than  by  any  particular  events  and  circum circumstances  stances circumstances  which  have  subsequently  occurred.  The  fountain  of  the  evil  has  been  in  the  hostile  feeling-4n  tho  unfriendly  mindi  which  has  so  loig  characterised  the  intercourse  of  the  two  Governments.  Lacli,  seeing,  nni  judging  through  this  medium,  have.tOrmed  the  most  perverse  lingual  con conclusions;*  clusions;* conclusions;*  each  has  argued  that  his  own  peculiar  interest  was  ,directly  .  coutrar.y  ..  to  the  interests  of  the  other,  and  that  America  and  England,  to  be  in  their  true  political  relation,  should  be  natural  enemies.  .  .  ..  ..  As  to  the  immediate  cause  of  the  American  Embargo,  it  must  not  be  contended,  but  that  the  English  Ministry  hue  apparently  committed  the  grossest  errors.  France,  with  the  view  of  destroying  the  English  commerce,  issued  the  Berlin  Decree,  by  which  she  erected  herself  into  the  Sovereip  of  all  neutral  nations,  and  in  this  asserned  cha character  racter character  issued  an  edict  for  putting  a  kingdom  under  block blockade.  ade. blockade.  •  The  promulgation  of  this  Decree  was  certainly  a  most  outrageous  extravagance  of  despotism.  But  it  had  not,  and  indeed  could  not  have,  a  practical  (Sect  commen commensurate  surate commensurate  with  its  Witness  of_  menace.  It  fell,  in  fact,  as  a  tru  Iv  n  J  . STYLE=superscript  :ellen—as  a  thunder-bolt  iu  the  seas,  extinguished  as  soon  us  it-fell.  it  was  in  vain  for  those  to  issue  an  edict  of  bluckaile;  - STYLE=superscript  who  had  no-aliiiii  .ntwnr  to  exccute  their  decree.  The  English  psissesseds  . STYLE=superscript  the  whole  fare  of  the  seas;  and  Neutrals  and  English  might,  therefore,  atilse  have  •  contemned  tlie'Berlin  Order.  Ilere,  therefore,  was  the  main  error  of  the  English  Ministry.  They  looked  rather  to  the  despotism  of  the  De Decree—to  cree—to Decree—to  its  extra  vagaat  insolence  and  haughtiness,  than  to  its  prectical  effect.  If  they  had  considered  only  the  1  latter  quality,  as  in  prudence  they  ought  to  have  done,  they  would  have  passed  the  French  Decree  in  sileut  con contempt--they  tempt--they contempt--they  would  have  deemed  the  contrast  of  its  menace  with  its  imbecility,  as  worthy  only  of  ridicule.  Instead  of  taking  it  in  this  point  of  view,  the  English  Ministry  most  absurdly  regarded  it  only  as  an  outrageous  insult,  and  acting  upon  their  feelings,  instead  of  their  judgments,  retaliated,  as  they  thought,  by  a  limiter  mea measure.  sure. measure.  Passion,  however,  is  usually  too  blind,  and  too  precipitate,  to  distinguish  the  exact  nature  either  of  its  objects  or  of  its  instruments.  And  NO,  in  feet,  it  happened  in  this  ca;e  ;  the  retaliation  was  so  only  in  appearance—it  was,  in  fact,  a  repetition,  an  extension,  at  the  mischief  upon  our  own  heads.  The  enemy  issued  a  decree,  but  could  not  execute  it.  hi  our  precipitate  folly  we  took  the  execution  iu  our  own  hands;  we  literally  swept  the  seas  ;  we  actually  blockaded  France,'  and  by  the  conditions  winch  we  imposed  upon  Neutrals,  prevented  them  erectus  ally  from  coining  to  our  own  Ports.  America,  unable  to  @ell  our  manufactures,  was  very  indifferent  as  to  buying  them.  Her  possible  commerce  was  !hulled  by  what  was  immediately  wanted  by  herself.  This  bias  rowpn  rnti  sely  very  little.  Two  important  results  immediately  follawed— follawedin  in follawedin  the  first  place,  ,our  English  manufacturers  suffered  most  I  considerably  from  the  diminished  demand;  and  iu  the  se- ",0002644/1809//0423/0002644_18090423_mets.xml
0003,"- STYLE=superscript  „,SUNDAY,  APRIL  23,  1809.  •.:  4.  t  ..  _  •  POLITICAL  DlSQl;l§rtioN.  ktIMBER.  SIXTY-SEVEN.  RELATIONS  OF  ARIERICA.  The  relations  between  America  and  England  become  so  critical,  and  may  eventually  lead  to  such  important  issues,  that  it  is  incurpbent  upon  us  to  cater  into  some  detail  upon  a  subject  so  generally  interesting.  There  is  something  very  peculiar  in  the  _general  relative  situation  of  America  and  England.  The  two  countries  have-the  same  language,  the  same  general  habits,  and  we  might.  almost  say,  the  same  mind  and  understanding.  The  Americans  are  not  of  the  common  stock,  without  participating  at  the  same  time  in  something  of  the  common  nature.  It  is  .the  characteristic  pride  of  Englishmen  to  think  and  speak  contemptuously  of  other  countries,  and  perhaps,  as  compared  with  our  own,  this  contempt  may  not  be  altogether  so  unreasonable  as  it  may  at  first  appear  ;  but,  to  use  a  vulgar  expression,  it.  I  would  be  defiling._:  our  own  nest,  to  feel  or  express  a  similar  contempt  of  the  Americans.  With  some  peculiar  I  national  habits  superinduced,  they  are  generally  the  same  with  ourselves;  they  have  the•  same  sensibility  under  in insult---they  sult---they insult---they  have  the  same  vices,  and  the  same  virtues.  Our  political  relations  with  America  may  he  considered  t  under  three  heads:—their  origin,  their  actual  state,  and  their  probable  results.  With  respect  to  the  origin'  of  the  present  relative  state  of  America  and  England,  it  may  be  briefly  observed,  that  the  hostile  feeling-  in  the  governments  of  the  two  people  I  are  coeval  with  the  American  Revolution.  Nations  have  I  their  pride,  •as  well  as  individuals.  We  cannot  forget  that  1  America  was  once  our  subject  ;  the  remembrance  rankles  ,  in  our  mind,  and  corrupts  all  the  benevolent  humours  of  our  temper.  We  see  nothing  in  America  but  a  successNl  repel,  and  her  present  tone  of  equality,  as  compared  with  her  former  relations  as  a  dependency,  have  to  us  the  ap appearance.  pearance. appearance.  of.  insolence.  America,  on  the,  other  hand,  feels  naturally  indignant  that  we  refuse  hec  the  rank  and  esti-  Illation  which  belong  to  her;  and  from  this  state  of  feel feelill,  ill, feelill,  and  indeed  of  mutual  acting,  between  the  two,  it  cannot  be  denied,  that  America  and  England  have  uever  been  amicable  at  heart.  The  conduct  of  the  PITT  Minis Ministry,  try, Ministry,  moreover,  which  was  so  long  in  power,  still  further  aggravated  this  original  ill-leven  ;  they  almost  laboriously  insulted  America  even  in  their  diplomatic  appointments.  Those  men,  who  have  been  termed  American  Loyalists— Loyalistscertainly  certainly Loyalistscertainly  a  very  honourable  and  respectable  class,  but  certainly  too,  tot  men  to  be  in  favour  with  the  American  Republican  Government—these  men  wore  appointed  as  Consuls,  Envoys,  and  Ambassadors.  Their  conduct  was  such  a  reisht  have  been  expected  ;  they  ostentatiously,  and  sumetlines  outrageously,  adopted  the  most  haughty  tone,  and  avenged  their  former  misfortunes  by  their  pre pregent  gent pregent  contempt.  The  actual  relations  of  America  and  Great  Britsia  have  rot.  11.—Ac. ",0002644/1809//0423/0002644_18090423_mets.xml
0005,"?fit  'NATIONAL-  Afittit  43.-  •  V  t  6  - STYLE=superscript  14  N  %,MAncn  —T  he  prepai  a  t  ions  ft,H-  de  fence  si  i  son sonthine.  thine. sonthine.  Inllungary  the  5‘..?  comities  not  only  furnished  the  incur incurrerrtion  rerrtion incurrerrtion  v,  ith  the  troops  required,  but  even  voluntarily  organise  still  more  troops.  1n  beside's  the  insurrection,  600.  Cavalry  athi  two  battalions  of  infantry  have  been  supplied.  Usher  counties  have  set  a  like  example.  Also  the  thief  Nobilitv  and  Magnates  have  equipped  troopt.nt  their  own  ex  pence.  STR  R  GU,  APRIL  4.—This  day  the  Prince  of,  Neuf Neufchatel  chatel Neufchatel  arrived  here.  His  Imperial  Majesty  a.  1 STYLE=superscript  ,3  soon  expect expected  ed expected  here.  It  is  said  that  the  head-quarter,;  of  the  grand  army  of  Germany  will  fora  time  be  established  here.  Gen.  Bertrand,  the  Ernperrer's  Adjutant,  arrived  here  on  the  Ist.  ULM,  Ain  i  t  6.—There  are  great  movements  in  the  army  of  the  Duke  of  l  ivoti.  A  part  marches  from  this  neighbourhood  to  the  Tyrol,  another  passes  by  the  Denanworth  to  the  Is'er,  mid  several  regiments,  cannou,  &amp;c.  are  convey  ing  by  the  Danube  tb  Lower  Bavaria.  MUNICH,  APFIII,  s.—Travellers  from  Saltzbwrgh  bring  the  concurrin;  report,  that  the  Aw4rian  forces  have  so  increased,  that  in  that  town,  the  population  of  which  does  not  exceed  11,01)0,  more  than  '20,000  troupe  are  collected,  and  in  the  neightmuring  country  about  30,0a0  are  quartered.  .  •  It  11U11.GTI.  APRIL  formidable  Austrian  Army  in  advaaci  in;  against  tlio  liavariaii  frontiers.  A  courier  mho  left  Possau  early  Yesterday.  has  brought  intelligence,  th:.:l  no  hostihlies  have  yet  taken  place.  259  PR  I  VATI.  LET  I'  La  OM  SPAIN.  CA  DTZ,MA  RCIf  23.  On  the  lSth  instant,  the  French  passed  the  l'agits  at  the  Puente  del-  ArLohispo,  and  Almarez,  to  the  tinnih:r  of  ;10,000  men.  At  the  moment  of  thc  ;111;!ck,  El  Puente  was  deferded  by  6;100  men,  who  were  turned  by  the  hostile  army,  which  forced  its  way  in  spite  of  their  resistance.  Cuesta  then  retreated  with  his  whole  arm  . STYLE=superscript  ..,  in  the  best  order,  and  w  ithout  losing  a  single  man.  AccordinK  to  the  dispatches  of  to-day,  he  (Cuesta)  is  at  Truxillo,  but  wi'th  the  imention  of  retreating  furtheayshould  the  enemy  contioue  to  ad  vahco,  and  of  uniting  himself  with  our  regiments  of  marine,'  which  w  ma  aging  towards  hiin,  and  the  King's  s STYLE=superscript  regrment,  and  that  of  Villavicinsa  (hhth  cavalry)  which  having  been  inhumed  hal  left  ties  ille  on  the  same  destina destination.  tion. destination.  There  hate  übio  gone  nut  to  incorporate  themselves  w  i  tit  Citesta's  arm  v,  another  real  p-  latrlv  equiped  at  Seville,  as  well  as  at  Badh,ioz  :  po  that  in  a  few  days  we  may  expect  to  count  41,000  fighting  men.  The  army  or-  La  111  ncha,  t.nder  the  eh  in inmand  mand inmand  of  UrhiLet,  n  hose  head  quarters  nee  rt!  Valdrpf  , STYLE=superscript  nas,  march marchra4l.lly  ra4l.lly marchra4l.lly  towards  Toledo,  ih  nrder  to  fall  upon  the  rear-;.;ttird  of  tie  enemy.  The  van-,:thtrd  cotopncs.d  of  •1001  cavalr  . STYLE=superscript  ..•  tied  the  same  number  of  light  trohns,  under  the:comma  ul  of  .11hur .11hurtitwrntte,  titwrntte, .11hurtitwrntte,  was,  w!  el  the  last  tli-patches  arri‘ed  f  ont  thence,  within  six  leagues  of  Tolohlo  ;  and  in  this  city  the  cnetuv  had  concentrate:l  their  whole  forces  - STYLE=superscript  e:  , STYLE=superscript  :cept  the  horly  w  hie%  was  t  advance  against  Cuesta,  amounting  in  all  to  men,  there  not  remainiag  inure  than  :  - STYLE=superscript  .:009  at  Matirld,  and  '..000  at  Ara  nez.  15  rhina  has  in  alt  3  ).000  ;  hut  lie  and  Cat  - STYLE=superscript  sta  posse..;s  a  greater  'mintier  Of  iheo  th,ut  the  eneinv„,  a  greater  number  are  without  arms;  hence  they  are  re:lured  to  remaining  in  the  rear,  till  an  action  takes  place,  when  they  endeavour  to  seizehmskeis  from  the  deal,  the  woinnied,  and,  if  possible,  from  prisoners.  In  this  state  of  thio  :  .  , STYLE=superscript  ,s,  and  tnnwing  the  activity  which  pre prevails  vails prevails  as  to  the  arming  . STYLE=superscript  an  OrZani  Zing;  t  fle  arllliCF,  we  fear  nothing,  and  have  the  greatest  confident  e  that  we  shall  see  the  enemy  driven  back.  was  after  his  derihg  attem  W  ?it  to  surprise  Barce Barcelona,  lona, Barcelona,  which  as  frustrated  by  the  treachery'  of  'come  of  his  o!licers,  and  after  having,  forced  a  passage  through  the  hostile  army  which  surrounded  him,  though  with  , STYLE=superscript  ireat  loss,  has  ret  !ru !rued  ed !rued  to  the  head-quarters  at  Tarrenona,  where  Blake  is  to  jein  him  with  the  division  which  Laran  formerly  commanded,  and  Which  has  now  been  eta  rusted  to  him.  The  spirit  of  the  people  -remains  the  same;  things  go  well,  anal  they  will  persist  t;1  the  ;  end  is  gained,  thotn:h  at  the  price  of  e;reat  sacrifices.  The  in interior  terior interior  provinces  occupied  by  the  eminiy  are  at  open  war  with  him;  he  commits  his  accuinstarett  cruelties,  hot  nothing  deters  the  people:  - STYLE=superscript  he  practices  his  usual  fraials  artifices,  but  even  these  are•of  no  ave:l.  In  Cialliela  Asthria  affairs  aro  ~rowi ~rowing  ng ~rowing  very  serious  for  them,  and  the  rtitlians  ltnaw  not  what  to  do.  Their  arinies  are  dhnitilliing  considertthlv,  while  oars  encreaseevery  day,  and  are  learning  the  art.  of  •  war.  This  is  our  real  situation,  mid  I  von  to  helieve  nothine;  t  the  con contrary  trary contrary  ;  for  1  have  purposely  delayed  writing  till  now.  that  I  might  send  you  nothing  which  I  had  not  thyself  observed  and  reflected ",0002644/1809//0423/0002644_18090423_mets.xml
0006,"SPA  IN.  M  DTI  ID,  APRIL  c  2.  GeneralSrnASTltNi  announces  front  Santa  Cruz  at  the  foot  of  the  Bierrt  Alitreria,  .under  date  of  the  ‘29th  of  March,  that  on  the  27th  lie  descried  the  Spanish  army  of  Andalusia,  to  which  *ere  joinrd  a.  vast  number  of  peasants,  stationed  in  order  of  battle  before  Ciudad  Real  ;  that  he  advanced  against  them,  routed  and  destroyed  them  without  any  resistance;  that  on  the  `2St  h  the  feeble  remains  of  that  army  wi-re  on  the  other  side  of  the  Sierra  Morena;  and  that  the  p:oiluce  of  this  affair  was  4030  prisoners  of  war,  7  stamlarits,  and  18  pieces  of  comma.  .Among  the  prisoners  of  war  are  197  Officers,  of  whom  4  are  Colonels,  and  . STYLE=superscript  7  Lientenant-Colenels.  A  great  number  of.the  enemy  were  slain.  More  than  3000  were  put  to  the  sword  by  the  .  cavalry.  We  have  lo=t  but  30  killed  and  60  wounded.  Colonel  GtitA  UD  of  the  12th  Regiment  of  Dragoons  was  severely  wounded  by  a  ball.  The  Colonel  of  Dutch  Hussars  was  also  woufulei,  Gen.  Sri;  ttiri  A  N  t  praises  exceedingly  thechielof  his  lota  EIGUILLE,  who,  theday  befork  the  battle,  crossed  the  Guadiana  in  company  with  general  alt  c,tt.tun,  -in  order  to  prevent  the  bridge  being  broken.  in  whiCh  he  succeeded,  General  Mt  maAtro,.  his  Offi Officers.  cers. Officers.  and  troops,  distinguished  theinselves.  '  following  day  the  fugitives  were  pursted  by  the  cavalry,  and  two  of  the  enemy's  Generals,  who  were  among  them  were  slain.  General  SERA:4m  N  n notite  otite notite  .490  at  •the  foot  of  the  Sierra  Morena,  and  found  himself  Ibl  .  l  aline  with  the  Duke  of  LLU  (VICTOR),  who  must  already  have  advanced  beyond  Merica.  At  the  same  moment  that  Genoral  SETIISTIANI  captured  Cindad  eat,  and  arrived  at  the  foot  of  the  Tierra  Moreca,  the  Duke  of  Lint.t.ti  so  won  the  battle  of  Merida.  The  troops  of  reserve  of  Seville,  Badajos,  - STYLE=superscript  and  were'  collected  together,  and  placed  in  order  of  baffle  by  Gen•:-.  ral  Ctir!r  t,  upoa  an  elevated  plain,  tiettt  ren  D  ouberiite  and  ;Medellin.  a+4  w  hich  was  covered  by  the  Guadiana.  This  army,  formed  in  thee  lines,  was  supported  by  batteries.  flo;  sf  on  TA  the  Duke  of  t  r.  t  t.O  Y  o  observed  this,  he  com commanded  manded commanded  the  cavalry  of  Clene,rals  t.t.e  and  LATOUR  MA  V VTIOU  TIOU VTIOU  RG  to  plate  theniselve's  in  an  oblique  line;  and  he  ordered  General  A  V  %I,  to  place  himself  wit  h  the  division  of  the  Princes  of  the2Clarederation  of  the  Rhine.  in  a  close  column,  between  C:e  above  +aril!  ioned  cavalry.  lie  orengthened  him  with  14  piN:es  of  artillery,  and  placed  the  iiivisions  Vitiate  and-Rutfin  in  t  rear.  The  Duke  of  %fIf,I.UNO  - STYLE=superscript  attacked  . STYLE=superscript  the  left  wing  of  the  ene  ray,  and  inmantly  tnrew  it  into  confusion.  The  centre  and.  right  winA.  were  also  routed.  Seven  thousand  Spaniards  remained  on  titi-  kid  of  battle  :  3000  were  made  prisoners  ;  the  remainder  were  dispersed.  Thirty  pieces  of-cannon  and  nine•colours  have  into  our  . STYLE=superscript  hands.  This  important  enza;einent  has  laid  open  Seville  to  us.  The  fugitive;,  arc  pitructi  a  ith  the  utiowit  activity.  On  the  29tit  of  ,filar  h,  the  adva!irea  guard  of  the  Doke  of  BELLUNO  a  l STYLE=superscript  Ved  On  riOt  side  of  and  it  hoped  to  u.;i!e  it  with  the  Doke  of  IiaLMATIAOIhO  )  it  is  thought,  e  :t'.4  . STYLE=superscript  eady  entcted ",0002644/1809//0423/0002644_18090423_mets.xml
0007,"SWEaN.  STOCKHOLM  {  A  ran.  7.  The  King  is  still  in  confinement,  and  every  day  makes  it  less  probable  that  he  will  soon  he  set  at  liberty.  Al.  Alopclts,  the  fanner  Russian  Envoy  to  the  Swe Swedish  dish Swedish  Court,  whom  the  King  put  under  atTest  at  the  commence commencement  ment commencement  of  hostilities  in  Finland,  has  been  here.  lie  had  a  pri private  vate private  audience  of  the  Duke  Sodermania,  for  upwards  of  three  quarters  of  an  hour.  N  o  one,  except  Baron  Lagerbjelke,  was  present.  When  he  left  the  Duke's  apartment,  there  was  a  crowd.  stf  noblemen  who  viid  tiveir  respects  to  Ilia).  Every  one  was  surprised  to  see  him  so  sutkicoly  at  St  q  kholin,  and  still  more  so,  when  he  left.it  in  the  inorohT  oa  the  third  tla'.  ;  .hut  the  fact  is,  that  M.  Alopeus  wos  w  it  lo  the  Russian  army  at  Grissleharo.and,,  it  iS  said,  had  a  hrei,et  nom  the  Fatiperor  to  he  Lo,rd  -- STYLE=superscript  Lieute Lieutenant  nant Lieutenant  of  Stockholm,  as  the  Russian,  who  knew  something  More  than  we  of  the  plan  of  the  Revolution,  had  no  doubt  whalever  but  they  ‘vouli!  take  possession  of  Stockholm.  '  .  His  Excellency  Baron  Steditigk,  as  tell  Ls  Nt.  Alopeus;  has  Fet  out  for  Abo.  w  nitre  the  Emperor,  it  is  said,  meet  Item  at  the  end  of  this  moot!).  The  Rossini'  trolts  at  Umea  have  taken  Tornvo.  Nlai.;r  de  la  Grawre,  who  Vk  CIA  to  Paris,  is  anNiomly  expected,  awl  we  have  the  most  siugalar  reports  :  amongst  tuber,,  that  Ilonaparte's  order,  or  ad%  ie..  to  the  King  of  Dk'nmar:;,  not  to  be  if  owned  so  soon,  1)::s  re  .. STYLE=superscript  erence  to  the  political  ciate  of  Sweden;  that  Denmark,  Sweden,  and  N  or-  P3_TB00018 ~'~.  P3_TB00019 II  P3_TB00020 U ",0002644/1809//0423/0002644_18090423_mets.xml
