art,text,issue_name
0037,"THE  - STYLE=superscript  .  NA  T  1  °NAV  Q  1  TER.  AIMUL  t  5:  Lein'  RV  PO  litT.•  '  '  COURT  OF  cnicsituy,  APRIL  1,.  aroaltis,  w  - STYLE=superscript  t*  v.  COLMAN.  This  was  rid  application  to  remove  Vr,Coltnan  from  t  he  ma mahagetnent  hagetnent mahagetnent  of  the  LlaymackerTheatre,  to;  whicb,  it.  was  alleged,  he  was  incenspetent,  as  being.  confined  for-debt-within  the  rules  of  the  King's  Bench.,  ,There  teas  a  variety.  of  other  allegations  of  mismanageMent  ;  ,but  it  wvas  stated  in  the_  defence,  that  by  agiWiTreiriliet  wreathe  parties,  'ail  such  matters  shouid  - STYLE=superscript  have  been  sobipit4efl  to  arbitration.  It  was  .  also  asserted,  that  the  pro propertty*as  pertty*as propertty*as  so  far  from  being  deteriorated  that  eight  shares,  which  in  ISM  were  sold  at  2,300  1 STYLE=superscript  .  each,.  in.  IAO7  weie..estitaated  at  each.--3  Udginent  deferred.  •  •  •  •  •  COURT  OF  commoN  p.Lr....ks,  APRIL  26:  •  •  •  MADAME  CA.TAL  AN  I.  MOND  V.  V  PARREQUE.  This  was-am/teflon  - STYLE=superscript  to  - STYLE=superscript  recover  129!.  for  goods  sold'and  de delivered.  livered. delivered.  •  Serjeant  Shepherd  opened  the  case,  and  stated  that  the  plain plainsitr  sitr plainsitr  etas  the  husband  Of  MadaMe  Jayinond  fattcy  dreg-'Maker  In  this  city..  The  defendant  Was  .a•-man  of  great  celebrity,  not  on  his  otYri  merits.  but  on  those  of  his  wife,  who  as  'Madame  Va Valabrentie,  labrentie, Valabrentie,  .WOuld  never  he  known  ;  but  as  the  .  fascinating  and  charming  men,'  Maidam  Catalan'.  was  lowien  to  every  person.  The  articles  furnished  by  the  plaintiff  were  dresses  for  this  famousaVid  favourite:sin:ter,  to  perform  in  it  the  Opera  House.  Ilehoped  not  hear  from  his  !warned  Brother,  thltt  the  defemlantsdid.  not  countenance  her  obtainingand  wearing  those  dresses.;  for,  •if  he  did  he  would  Prove  to  the  contrary  :  the  defendant  reeeiVedfind  paitOok  of  flie•  S  . STYLE=superscript  .0001.  a  that  those  dresses  assisTencer  to.  .Madpme  Catalani,  although  a  singer  of  the  greatest  taleatf,  yet  she  required  to  he  dressed  tip  appear  before  a  Britisbaudiente  ;  she  was  also  an  excellent  actress  and,  what  Was  mote  Pleasing  to  Gentlemen,  her  person  was  very  handsome,  and  .nn  person  could  object  that  an  Italian  singer  shoind  be  dressed  as  well  on  the  stage  as  an  English  lady.  The  defendant  attended  the  Making  of  thedresses,  and  particularly  to  a  figure  ju  wax,  which  was  made  to  repreSeni  Catalani  in  the  character  - STYLE=superscript  of  Semi  ran;i4le,.  in  :  the  serious  apera.of  that  name.  He  gave  direetious,  and  attended  the  dressing  of  it,  The  second  dress  was  for  the  cootie  Opera  of  •Paschlann.  [Here  the  Learn Learned  ed Learned  Serjeant  was  interrupted,  and  informed  by  Serjeant  Best.  that  the.  articles  furnished  were  not  dispuied.]  He  continued  by  saying,  the  plaintiff  paid  her  the  most  uereinitting  at  teatiott,.ttsed  to  attend  her  at..the:  Opera  House  to•dress  her,  and  for,both  when  he  :tsked  for  her  money,  the  defendant  told  her  she  must  apply  to  the  Trustees  of  the  Opera  House.;  she  did  . STYLE=superscript  fipPly,  and  what  answer  did  she  receive/  that  the  Opera  House  had  their  awn  dre,s-teakers..  )le  did'  think  Madame  ratatani  acted  right  in  not  eniPlitying  them  ;•  they  might  answer  a  fist:senate  at  2/.  a  month,  -hut  - STYLE=superscript  wank!  not  become  a  foreigner  receiving  NOM  a-year  from  a  generous  public.  It  [was  not  his  **labia  depreciate  her  merits,  for  there  was  no  man  admired  them  more;  in  fact,  he  admired  both  the  taste  of  the  husband  awl  the  wife,  but  he  confessed  he.  considered  that  of  Madame  Catalani  -the  most  re re'fined  'fined re'fined  when  .she  warbled  her  sweet  notes.  (At  this  moment,  a  waxen  doll,  abottt  - STYLE=superscript  three  feet  in  height,  dressed  in  character  of  Semiraadde,  was  passed  over  . STYLE=superscript  the  heads  of  the  spectators,  and  placed  en  table,  to  the  00  small  diversionaf  the  Court.  The  figure  and  features  were  net  -unlike  Madame  Catalani).  The  .I.e9rued  Serjeant  then  proceeded.  lids  is  a  specimen  of  the  dresses  in  Miniature.  Inking  hold  of  the  train  of-crimson  velvet,  trimmed  with  gold  lace.  He  desired  the  .Tury  to  look  at  the  diadem  and  veil  tin  the  ke:id.  and  ask  themselves  if  any  Opera  House  or  Theatre  could  facnish  them.  He  then  told  them,  if  they  were  unacquainted  .with  the  manner  they  commonly  made  up  dresses,  he  would  inform  them,  in::trad  of  silk,  they  would  have  glazed  stuff.  He  concluded,  ,hy  sayia  - STYLE=superscript  :,  he  would  leave  the  case  to  the  Jury,  and  he  bad  not  a  doubt  but,  they  would  give  a  Vprdiet  for  the  plaintiff.  He  then  proceeded  to  call  his  witnesses.  Serjeant  .Best  then  addressed  the  jury,  and  said  that  notwith notwithstanding  standing notwithstanding  they  had  been  told  the  defendant  had  received  eight  those-and  pounds  a  year  by  the  abilities  of  his  wife;  he  did  not  think  it  becoming  of  a  French  miltinerto  instruct  - STYLE=superscript  her  counsel  to  talk  of  thei  large  profits  of  any  othearfareigner  ;  and  when  Malian  singers  were  ordered  out  of.  the  country,  be  'trusted  French  milliners  would  not  be  left  behind.  .  lie  was  coovi4ed,  if  their  yerdict  was  in  favour  ortha  elaiatiff,  it  mast-be  becauge  ,••  ...  Alit  i  ~4  /  ••••111.11911.11p  i  Vi•  •  •••41.•  •  •  4111146...  •  ••••••  •.a+  •  •  •  ~~~,  he  (Serieant  liesi)  did  not  de  his  ditty:  tie  would  prove,  that  t  hough  Maclaine  Catalan',  bY  'fief  agreemiatt,  was  paid  sti  lat,t6  a  sum,  yet  it  was  specified  that  she  was  to  be  furnished  by  thd  opera-house  with  her  dresses.-;--There  is  nothing  in  law  or  morals  that  said,  if  you  entrust  one  person,  and'  he  is  not  able  to  pay;  that  another  should  be  Made  to  pay  it.  Ile  said  Nladame  lani  had  had  private  dealings  with  the  plaintiff,  and  had  paid  her  a  bill  amounting  to  45?.  and  got  a  receipt  without  ever  Hi  having  been  intimated  to  her  that  there  was  any  other  demand  against  her.  lie  would  further  prove  that  she  cautioned  the  plaintiff  to  he  on  her  guard  as  to  her  payment,  for  she  did  not  consider  herself  answerable.  He  Concluded  by  stating,  that  hti  was  Confident  the  Jury  could  not  hesitate  far  a  moment  in  givitig  a  verdict  for  the  defendant  ;  he  was  cettain  w  hen  ire  proved  - STYLE=superscript  these  points,  his  Lordship  would  not  allow  it  to  go  to  them.  Mr.  Intville  proved  the  articles  of  agTeement,  which  Fpeci-  Ified,  that  Itiadarae  Catalan'  was  to  be  furnished  with  these'  ;by  the  operaof  her  own.thoosing.  Lord  Chief  'Notice  Mansfield  observed,  it  must  haVe  Hiropossible  for  the.plaintiir  not  to  have  known  she  was  Working  for  the  oPera-htiase,  yet  it  was  a  sery  hard  ease  ;  and  he  emild  !tint  avoid  saying;  that  it  was  scandalous  and  infamous  treatment  . STYLE=superscript  hetweeh  the  trustees  of  the  opera-house  and  Madame  Catalani  awl  if  she  was  to  ask  his  Opinion,  he  would  tell  her  to  pay  OW  ;plaintiff  if  the  opera-house  did  hot;  but  as  ttte  ciremustancel  ware,  *  he  most  order  a  nonsuit.  The  ttas  accordingly  iionsui  tett  That  extrettiely  curious  little  Tract,  entitled  The..  Spirit  i  t  ,  Ffiglish  Wit,is  an  eutertaining  budget  of  lauzhable  anecdotes;  smart  repartees,.  prize,bulls,  pointed  epigrams,  humorous  epi:t  taphs,  droll  dtscriptions,  sprightly  itticisms,  singular  cliarae;-  ters,  bursts  of  merriment,  curious  advertisement~,  tlight  of  ittlg  gination,  effusions  of  fancy,  lite.  including  . STYLE=superscript  several  Jett  d'Espritz..  TO  be  had  of  Thomas  Tegg,  No.  l  l  1,  Cheapside  s  arid  of  nit  booksellers,.  BIRTH.  GlOureAershire,  the  wife  of  a  pan.  Mao,  nutted  Kilby,  of  four  children,  three  of  whom  are  liv  ing.  MARRIED.  On  Sunday,  the  9th  instant,  at  Smith  Da:ton,  Mr.  Thnulls  Fisher,  aged  69,  to  Miss  Granger,  his  hooseio-eiwr,  aged  after  a  short  courtship.  The  banns  of  marriage  bet,.‘,'  ea  the  bride  and  a  roan  man,  her  fellow  servant,  %i  ere  to  11.1  %  e  heed  published  on  that  day:  At.4lphingtou,  Mr.  Richard  Hellings,  aged  90,  to  Flurford,  aged  19.  IMED.  •  On  Thursday  morning,  Earl  Harcourt.  in  Merrionzsquare,  Dublin,  the  Coni,te34  Dowager  of  Mayo  likewise.the  Dowager  Lady  Sirele.  LLOYD'S  LISPS.  •  TiJCStiay.  p  The  A  metli3st  frigate,  of  *guns,  arrived  at  Plymouth  ou  Thu  rsiftY:  On  04  Gth  iust.  Abe  captured  the  Niemen  French  friate.  of  4tv  guts  (unite  new)  and  30  teen,  hotitti  from  Bordeaux  to  the  Isles  of  France,  afit.r  4  . STYLE=superscript  4  action  of  hour,:  and  forty  minuto.  The  Amethyst  bad  S  men  killed  .t  7  wounded,  and  lust  her  main  ai4  iniztr.t  , STYLE=superscript  rna4t.  -  The  Nitanen  bad  47  min  killed  and  7:4  wow:  :.N1  and  was  totally.dismasted.  .She  was  left  in  charge  of  the  Arothuoa  frizate,  Which  came  up  at  .the  close  of  the  action.  -  _  The  firit!sli  brig  lilizsibeth  and  Emma,  reported  tr,  belott  at  La  tiuira;  vtar  there  well  ilst  January.  The  Ilerw.ick,  Griffiths,  from  London  to  Barbadoest,  statetto  captured  anti  carried  into  Gnadaloupe,  arrived  at  Jamaica  l&amp;th  14  1 STYLE=superscript  .hrpoary.  .  The.  American  brig  Bata%  ian,  Bradie:•  ,  from  Jacm  el  to  London,  wag  &amp;talc  . STYLE=superscript  Ni  l STYLE=superscript  15th  Feb:  by  the  Avon  sloop  oi  war,  and  seat  into  .1J  maica.  The  Volunteer,  Martin,  from  atina  to  rhiLl  w  bleb  ptit  iuto  Si  .  to  distress,  is  condemned.'  Cargo  sold.  t. STYLE=superscript  ree  V  4  illtain,  of  Loudon;  bf  . STYLE=superscript  4.ltintit  300  ladelt  with  11isthoganl;  is  take:a  lit  a  French  petvateer,und  carried  into  Mortaix.  •  The  tieptnne,  Purdy,  is  taken  and  carried  into  2  a  nte.  The.  Item),  Carnachan,fro.n  Deme  rara  to  Groeui  ,ck,  is  put  into  Gren.ida  leakj  and  noloading.  The  Active.  Wall,  from  TeneritTe  to  London,  ill  taken  and  cArri,..tl  into  Francei:'  The  brig  . STYLE=superscript  Dispatch,  lvliflrun,  from  wAs  tai  en  the  .Stli  Merat,  ht  lat.  411,  51,  . STYLE=superscript  .  6.  7.  by  the  Itevanche  French  pri%*ateer.  The  (.'vrns  from  Jamaica  to  Halifax,  on  Cape  Corierteg,  The  Margery  and  Mary,•  Will:union,  from  IA  idon  to  'New  Pros  ideace,  wait  captured  i9tiiJan..by  the  Papiiios  French  Brij  cl  war,  and  burnt  Tie  IWo  Sister!,  Ilau•phy,  from  Liihon  to  4  uglai.id,  is  lost  on  the  Tagus  crew  saved.  r„  ....  1~  I  I  I~  P15_TB00021 i.  diadem  and  veil  tin  the  ketid;  nod  ask.  themselves  if  any  Opera  Thornav,'.:  la  distre.=,s,  is  condemned.  cargo  ;viii.  ,  Tl,e  Vt  113  am,  of  Loudon;  of  about  ..:00  t  9  ii,  lade.  t  with  Mahogany;  is  taken  iii  .  House  or  Theatre  could  furnish  them.  lie  then  told  them,  if  a  Frenc  h  Ingvateer,•and  carried  into  Moriatx.  •  they  were  unacquainted  .wi-th  the  manner  they  commonly  Made  •  The  tieptnne,  Pitrdr,  is  taken  and  carried  into  2  lute.  .  •.  •  •  ttp  dreises,  he  would  inform  them,  intend  of  silk,  they  would  The  Hero,  Caraachau,  fro.n  Demerara  to  tiree,A  ,cir,  ii  put  into  Caen  lila  leakj  ~  ,  ,  s  ,  ,  •  have  glazed  stuff.  He  concluded,  ,by  savin  . STYLE=superscript  :,  he  would  li•ave  and  tutload  .  ing.  _  the  case  to  the.  Jury,  and  he  had  not  a  doubt  but,  they  would  .  give  a  Yfrdiet.  for  the  plaintiff.  lie  Omit  proceeded  to  call  his  1  1:h  i,e  e  Artist..  IN  all,from  TeneritiZ  tLc  neon  )  I  ken  and  e  rri  d  int  F  .  0  1  ,  ,**  a  •  4  ...  .  0  r.  ..,_  brig.  Dispatch,  MiritNn,  loon  —,  w,et  tai  en  the  t  'Ali  Merat,  in.  lat.  4.ii  i  51.  6.  7.  Iri  the  Revanche  Freud*  pri%*ateer.  '  4  '  i  witnesses.  .  The  Cvrns  LOOM  - STYLE=superscript  from  Jamaica  to  Halifax,  iiio4t  on  Cape  Coriertea,  •  -  The  Niart...,..e  .  ry  and  Mary,-  W  .  i  .  llamion,  from  .  to  , STYLE=superscript  t  tdon  to  New  Pros  ideAce,  th  at  Serjeant  Best  then  addressed  the  jury,  and  said  that  notwith-  .  i  captured  49  t  h  Jan.  the  Papnios  French  bris  ci  war,  sad  burnt  Maud  i  rt.o.  they  had  been  told  the  defendant  had  received  eight  Tie  Two  Sisters,  'Murphy,  from  Liihon  to  4  uglaud,  is  loit  on  the  Tarns  -  .  !1  , STYLE=superscript  thon-  , STYLE=superscript  and  pounds  a  year  by  the  abilities  of  his  wife;  he  did  not  crew  saved.  ,1  thin  ernm  a  re  k  it  hing  of  French  milline  FRIDAY.  .  rto  instruct  - STYLE=superscript  her  counsel  :  .  -  4:  to  talk  of  llif  , STYLE=superscript  lttrge  pro  fi  ts  of  any  othearfareituer  ;  and  when  Th  e  F  ann  y  an  d  A  lmira  w  Hick;„  waz.  t•thenbv  it  Dattiskpri  career  in  Nov.  last`  ,:  ...  'ltalian  sin,..;ers  were  ordered  out  of  the  country,  be  'trusted  retaken  hy  hi.;  Majeit.'s  ship;  Hound,  - STYLE=superscript  irtinint.,  awl,.  Chart  , STYLE=superscript  ,:lr,  ant  .e:.t  into'  French  milliners  would  not  be  kft  behind.  .}le  was  coovit4ed,  •  •-  •  ,  1  Ltpieroo2l7there  5...  e  r'ertaine4-24th  nit.  Tito:Dankh  Over;  arrival  at  Leith  17th  ,  priacti  to  his  7#,FikiestA-  7  hip-iViii..?,.  4  ;I  if  their  verdict  was  in  favour  ortha  plaintiff;  it  mast  be  becauge  ;,  and  Loe:  .  •  .  :f•  -  •  !  ' STYLE=superscript  .q  !  .i  •  .  pk.....  Ali/  .  1 STYLE=superscript  .  .  1 STYLE=superscript  ~.  ••  ..  ..1  ;  •  .  .  •  '.  i  .  ,  ..  .  .  -  't ",0002644/1809//0423/0002644_18090423_mets.xml
0038,"FRIDAY,  .  .  .  'The  Fanny  and  A  lrnira  ~  Hickx.  w  az,  tsticeit  by  it  Daliisk  pr  . STYLE=superscript  ,  ceirer  in  Nov.  last;  retaken  by  his  Majeit,';  ship;  Hound,  - STYLE=superscript  A'ribunc,  awl,.  Cl.ar-,  , STYLE=superscript  ,:1r,  ant  :e:.t  into  LAiScrotut,  'Chem  0.  , STYLE=superscript  e  .1-errainto424lll  , STYLE=superscript  lat.  ,  i  •  •  ....  •  ,  Tirobankh  sloops  arrival  at  Leith  17th,  priz4i  to  his  Mitiest  .  )  , STYLE=superscript  l;-  7  1,3p-i.cLii..i,..  i  Ana  Davaret,  r  IP-  ,  .  +.r.  •  Y  ..  4S•  .-..  .. ",0002644/1809//0423/0002644_18090423_mets.xml
0039,"THE  NATIONAL  REGISTER.  APRIL  23.  PRICE  OF  MELD.  His  Lordship,  nn  Tuesday  morning,  from  the  above  Return,  and  Monday's  Return  of  Wheat,  ordered  the  L'ilve  of  Bread  to  be  continued  at  Hid.  this  Qaartern  Lnaf.  POTATOIIS,  &amp;t'.  AT  SPITA  ',FIELDS.  .  .1.  F  •  t•  1. STYLE=superscript  •  .C•  S.  X.  s•  Kidney,  per  ton  4  to  a  0  0  Ox-Noble,  per  ton.  2  15  a  3  0  Champi  on  s  3  10  a  4  0 STYLE=superscript  Apple  .3  10  a  4  10  ONIONS,  per  bushel  44  6d  'a  6s  Od.  HAY  AND  STRAW,  PER  LOAD.  l'.  F.  d.  X.  s.  d.  1.  S.  ti.  I  Hay  blo  0  a  612  0  Average  6  1  0  ST.  JAMES%  Clover  Straw  Hay  5  10  0  a  6  10  0  WIIITECHIPEI,  ..  /  Clovt.r  Straw  3  stay  S  nivileirce  Clover  Straw  •  1  7  0  a  1  12  0  13.  UXIIRIDGE.  CORN  INSPiCTOR'B  RETURN--A  '  X.  S.  S.  s.  c'.  Se  se•  B.  X.  S.  Wlteat,p.ld  22  0a24  0  1  Oats  .  Barley,  p.  qr.  2  4  a  2  8  I  Beaus,  p.  qr...  2  16  a  S  0  Peas  214  a  3  3  VRICE  F  MEAT-FRIDAY,  I.`l[TU  KI  'IL•  LD.  s.  ti.  s.  d.  Beer  5  0  a  6  4  lIEADI  OF  CATTLE  AT  ourmermn.  Beast!  Sheep  and  Lambs  5,604  C•lives  .  135  Figs  Ve:11  S  0  a  6  6  Mutton  6  a  6  0  1.  - STYLE=superscript  anb  6  1  1 STYLE=superscript  1  a  S  0  Perk  6  0  a  7  0  rRIL  21.  NEWGATE  &amp;  Carcase.  i  t  d.  5.  d.  Byer  4  0  a  fy  4  Veal  4  0  a  6  0  Mutton.—  4  9  a  S  Laiulo  G  4  a  7  S  Pork  6  0  a  7  0  ritmc  OF  ITOPS  IN  THE  BOROUGH.  8.1115.  X.  E.  s:  pocxzu.  E.  S.  5.  Kelit  30t  10  Ntia4eZ  ,  0  a  8  4  10  a  6  0  }  0  Estit  3  10  a  4  10  Farnham  PRICE  OF  TALLOW,  rElt  r.  4.  P.  d.  Town  Tel  ßow  ....  St  4  Stuff  PH)  0  Yellow  RusA.i.  ..  OS  0  Yellow  &amp;lap  let  0  White  ditto.  in  0  Mottled  ll4  0  Soap  ditto  ST.  J  kmr.5  9 STYLE=superscript  ,;1  4 STYLE=superscript  4  Amore  ii.,  TALLOW,  AT...  3  (7t.  tRE  MARKET  5 STYLE=superscript  WHITCeII4PIZ  MARKET  5  OF  LEAT  d.  (1.  salts,  50  in  SA  Ths.  each.  19  a2l  Ditto,  VP  to  R6l)lc.  each  ;  a  21.  Merchants'  Backs  l9  a  2(1  1.1  a  19  Fine.  Coach  Hides  Crop  Hides,  4S  to  4A)lbs.  for  cutting  19  a  23  C  S.  d.  Ctindles,  p.  dom  14  9  Mould  ditto  l5  6  Grates  14  0  Good  Dregs  l4  0  7d.  }Average  bs.  bid.per  a  stoue  of  blb.  HER,  Pelt  LB.  d.  d.  Crop  Hides,  ditto  30  to  1011)s.17/  a  lqi  Calf  Skins,  30  to  4011►  s.  ?6  as  2  50  to  1015  s.  a  39  70  to  mottle,  .41  a  Tanned  Horse  Ilieleft  '/O  a  411  Small  SeliS  (Greenland)  37  .i  J  9  Large  ditto,  per  dozen,  100  s  to  160. ",0002644/1809//0423/0002644_18090423_mets.xml
0040,"279;  The  Three  Brothael's  ftora  Quebec  to  Lndon,  which  was  orialiore  in  River  St.  Lawrence,  hits  been  got  off,  and  was  safe  off  Goose  island  in  February  ;  her  cargo  had  been  laudr:d  thure.  Cornwall,  Camphall,  arrived  from  Jamaica,  sailed  the  21  th  Feb.  in  com company  pany company  with  the  ntioti,  Kennedy,  for  London;  the  Margaret  Bog  ngd  le,  —,  tor  the  Clyde;  the  Besfast,—t--,  for  Ilelfast;  and  the  Berwick,  Griffiths,  for  Barba.  does,  under  convoy  a  tht  Musette  sloop  ar  :  parted  wh  the  Etiti  off  •..2..M  March  in  lat.  $  ll.  iong..bt.  30.  The  rest  parted  on  the  13th,  Cape  Nicola  Mole.  The  brig  'Zatavian  , STYLE=superscript  Fillia  tes, STYLE=superscript  from  Rochelle  ,  arrived  at  New  York  Inth  ult.  On  iGili  Jan.  she  wa.:  takes  by  the  Comet  ••loop  of  war  and  sent  for  Pl)  mouth  ;  te  next  ay  was  rvtakeit  by  the  On  ..tith  Feb.  she  was  captnred  by  the  Mani  of  Li  d STYLE=superscript  verpool,  and  on  the  Stit  March  was  retaken  by  the  Captain,  Cook,  and  Steward.  The  Reinvery,  Alexand.le,  arrivei  in  (Fe  river,  from  Curaccoa,  fell  in  with  yo•  Ficn.h  Lup:er  Prhateers,  of  about  WO  ineu  each,  on  Friday,  oil  Beachy  Head,  and  engaged  them  for  an  hour  and  a  half.  The  Danish  Lugger  ChrWiaa,  Drothoea,  laden  with  - STYLE=superscript  grain,  gin,  cheese,  &amp;c.  Prize  to  the  Bellerophron,  M.  W.  arrived  at  Aberdeen,  the  10th  instant.  The  Chomberg,  from  Guadeloupe  to  Bordeaux,  with  produce,  arrived  at  Cork,  11th  instant,  prize  to  the  Virginia  frigate,  The  Providence,  Pa  Cthati,  from  Jamaica  to  St.  Andreas,  is  totally  - STYLE=superscript  lost.  The  Harriet,  Preoon,  bound  to  Nassaa;  and  the  Exuma,  Burton,  boned  to  'Turks  Island,  front  Port-au-Prince,  arrived  at  Jamaica,  mouth  t'eliruary,  detained  by  the  Perth  SW.  The  Carr,  Barrett,  ftnm  London  to  Curacoa,  fell  to  leeward  and  put  into  St.  Martha,  front  whence  she  sailed  oth  February  for  Jamaica.  The  Catharine,  Dobliu,  from  St.  Thomas  to  Jannel,  was  lost  19th  December,  on  Santa  lieel.  The  Frie  n  dship,  William,  arrived  from  Port-au-Prince  , STYLE=superscript  sail  ed STYLE=superscript  4th  March  in  company  with  the  Harriet,  Clarlie  for  London.  and  parted  on  the  '.2oth  in  Lat.  31.  -  The  Earl  Bathurst,  --  from  Hayti,  and  Bermudi  to  London,  put  into  Baltimore  Ilth  February,  and  cleared  out  from  thence  on  14th  March,  for  Buenos  Ayres.  The.  Baltliaw  it.,  Cole,  from  Oporto  to  London,  put  into  Lisbon,  19th  ult.  The  Swedish.  Letter  of  !ills:ie  11iolton,  from  Cape  Francois  to  Gethenburg,  put  iato  Chariwtowit,  9th  alt.  in  distre.s,  havi  - STYLE=superscript  ...,;  been  on  Shore  on  the  Cakur  The  True  American,  Newson,  from  Port-au-Prince,  was  lost  near  New  'i  ors.,  the  20th  17trua.-2...  The  Mary,  liowe  ma,  ftoin  L.don  to  'Waterford,  has  put  hack  to  Porttuouth,  after  beating  otr  a  1.11:,77,e:  Ptivatcer  a  few  leagues  to  the  westward  Mt  the  Isle  of  syfr.....M.  Captain  prowl  saSv  the  Privateer  capture  a  Galaot.  The  Fcench  sloop,  La  Returnnue,  lacten  with  tv  &amp;c.  from  Bordeaux  to  Gitadalour,  was  captured  12th  iost.  by  the  Loire  Frigate,  aMd  sent  for  Portsinoilib.  The  Johanna,  Marla,  Zwart.  from  tbl.  North  Sea,  was  captured  2d  instant,  by  the  J4lll  K,  French  Privaiker,  anti  carried  into  the  Terri.  •  The  Auroxa,  Webber,  front  Bristol,  is  coadeloned  at  Oporto.  r  LONDON  MARK  ETS.  CORN  EXCHANGE.  FRID  tY,  .1  r  nit  91.—Thr  sepplies  of  Wheatthis  clay  were  rather  short,  and  prices  1  i  :her  ttimi  ton  NV  s  j.tarket.  11;ir1Py  likewise.  folly  maintalnc.d  ToLooda  , STYLE=superscript  ':  prick..s.  The  two.  oiorts  of  Beans  also  lookcil  urw  and-;  and  Oats  coin.  nranded  vi,uut  Is.  per  quarter  move  than  on  IMuntia.  Other  articles  as  under:  .  .  acnnENT  piaci*  or  con  N.  P.  P.  S.  S.  Vtbent  .....  Sii  a  92  .01.Pr1`,boilerAltlio  alio  1-ioe  elirt4i  1,0  a  FPI  :ReittP  (Nyw)  is  u  1e.,.  -.  4  a  49  'Mk  ditto  (New)  44  -A  A  I  Kilt  .(New)  'os.o  a  bO  Qat%  26  a  36  •  Per  i3aeli  of  Five  Eusltell,  or  1  p.  S.  37  a  30  Poland  ditto  ..  *  Fine  Ert.:liA  Flour  Second  ditto  Bart  Seed  £56  a  C  63  P16_TB00034 I ",0002644/1809//0423/0002644_18090423_mets.xml
