art,text,issue_name
0020,"120  •.  whom  le  - STYLE=superscript  77  - STYLE=superscript  Prettsitrifte  - STYLE=superscript  steTie•  — STYLE=superscript  r  ee STYLE=superscript  Stirt.  Mrs:  Clarke's  evidencet  had  been  very  deficient,  and  Captain  Sandoo's,  as  he  should  skew,  bad  been  oul  e  -.edam.  From  Vain.  Sandon's  evidence  it  appear appeared  ed appeared  that  :0..j0r  Tonyn  had  expressed  his  conviction  that  his  fa father  ther father  would  procure  for  him  a  Majority;  but  how  Captain  San.  don  )IV  . STYLE=superscript  O  t':.!  N  4.  ie  prevailing  on  Major  Tonyo  to  wait  for  some  days  longer,  and  not  to  withdraw  the  money  lodged,  had  not  appeared.  It  was  with  respect  to  this  particular  .  and  es essential  sential essential  point  that  he  had  discovered  .a  suppression  of  evidence:  Colonel  Hamilton  belonged  to  the  Waggon  Corps,  in  which  Sandon  was  also  a  Captain,  and,  of  course,  on  terms  of  intima intimaey.•  ey.• intimaey.•  Colonel  Hamilton  stated,  that  Captain  Sandon  had  told  him  n  y  the  same  thlins  that  he  had  given  in  evidence  before  the  Committee,  with  the  exception  of  some  very  important  cir cireuniqauces  euniqauces cireuniqauces  which  he  had  suppressed  :  he  told  that,  on  representing  to  Mrs.  Clarke  that  Major  Tonyn  doubted  of  her  having  influence  with  the  Duke  of  York  to  procure  his  promo.  Lion,  she  said  she  had  that  influence,  and  gave  him  a  note,  pur purporting  porting purporting  to  be  from  the  Duke  of  York,  intimating  that  Tonyn's  business  should  be  done;  which  was  shewn  to  Major  Tonyn  by  Capt.  Sandon,  and  in  consequence  of  which  Major  Tony's'  sup supposed  posed supposed  that  he  was  certain  af  promotion.  Capt.  Sandon  had  also  told  Col.  Hamilton  that  he  shewed  Major  Tonyn  another  note,  purporting  also  to  be  from  the  Duke  of  York,  and  stating  that  Major  Tonyn  should  be  Gazetted  that  night.  This  note  Major  Too:  n  had  got,  but  the  other  Capt.  Sandon  stated  that  he  had  in  his  possession,  butexpressed  a  wish  to  destroy  ;  but  Col.  Ha-•  thilton  earnestly  diSsuaded  him  from  it,  and  advised  him  to  tell  all  he  knew.  Mr.  Adam  and  I  dissuaded  Colonel  Hamilton  from  going  to  Mr.  Lowton  or  to  Mrs.  Clarke,  and  advised  him  to  remain  perfectly  neutral,  only  that  Le  should  go  to  Capt.  Sandon  and  get  a  copy  of  the  note.  Colonel  Hamilton  accordingly  applied  to  Capt.  Sandon  fora  copy  of  the  note,  and  having  seen  it  when  he  took  the  copy,  supposed  it  to  be  the  hand-writing  of  the  Duke  of  York.  His  Royal  Highness  was  convinced,  how however,  ever, however,  that  this  note  must  be  a  forgery,  as  he  had  no  recollection  of  writing,  nor  ditl  he  believe  he  could  write  such  a  note.  This  passed  on  the  Saturday,  and  on  the  following  (lay  Colonel  Hamilton  came  to  hiiu,  and  told  him  that  he  had  seen  Sandon,  who  said  he  was  not  unwilling  to  give  every  informzoiata,  but  that  he  had  destroyed  the  note,  and  of  course  had  sup  pte..sed  all  these  circumstances  in  his  evidence.  We  can  no  100,  , STYLE=superscript  ;er,  of  course,  rely  an  Sandon's  evidence,  but  must  have  recourse  to  Col.  Hamilton  fur  necessary  information.  Should  the  note,  however,  be  in  existence,  its  production  must  be  of  time  utmost  importance.  Thus  far  he  had  thought  it  necessary  to  explain,  lest  it  should  be  thought  that  these  facts  had  been  withheld  by  him,  or  his  friends  on  his  side  of  the  House,  to  serve  any  par particular  ticular particular  purpose.  Examination  of  Captain  Sandal),  by  Mr.  Pencr.va  1,.  Q•  Did  you  represent'  to  Calomel  Hamilton  the  same  circum circumstances  stances circumstances  you  have  told  the  Committee  ?  A.  I  told  Colonel  Hamiltou  what  I  knew,  and  what  1  have  now  stated  ;  I  asked  his  - STYLE=superscript  advice,  and  s  him  chiefly  what  I  knew.—Q,  Did  you  not  state  to  Co)  .  Hamilton  that  this  note  was  hi  the  Duke  of  York's  band-Writing.  A.  I  don't  recollect.—Q.  Did  you  whew  him  the  nets  ?  A.  I  might  whew  it  him  ;  I  don't  recollect.—Q.  Did  you  permit  him  to  tae  tx  copy  of  it  ?  A.  Not  that  I  know  of.—Q  Was  this  note  you  shewed  Col.  Hamilton  the  same  you  shewed  to  Major  Tonytt  respecting  his  promotion?  A.  I  do  not  recol recollect  lect recollect  ?  it  must  have  been  so,  I  think.—Q.  You  now  recollect,  however,  there  is  such  a  note  ?  A.  I  believe  the  note  is  mis-  •  laid.-  - STYLE=superscript  -Q.  Have  you  looked  for  it  lately  ?  A.  I  .looked  for  it  einerdny,  and  the  day  before-44  toug4.)--.Q.  And  this  is  the  nose  you  did  not  recollet  to  have  been  in  existence?  A.  If  I  Tentrid  have  (mind  it,  I  would  have  brought  it.—Q.  You  have  dune  all  .  von-could  to  find  it  ?  A.  I  have.--Q.  Did  you  never  say  you  had  destroyed.tlris  note  ?  -A.C9l.llamil  ton  told  me  to  tell  ertbry  thing  I  knew,  and  it)  destroy  nothing  I  might  have  rela relative  tive relative  to  thesullicet.—Q.  Did  he  not  tell  you  to  keep  that  paper  ?  Aud  every  other.  lie  tor  4  me  nut  to  destroy  a  single  note.  ..Q.  When  did  Colonel  Hamilton  take  a  'copy  of  that  note  ?  ut.  The  day  after  be  came  •to  town,  in  a  roffee.hou9e,  in  tsuuthasapton•rtimr.  Q.  De  you  not  recollect  stating  to  Colonel  Iflamiltosi  that  put  would  willingly  follow  his  advice,  but  that  he  would.  l  •very.  augry  with  you  to  hear  that  you  had  &amp;Strayed  it  i  A.  I  neverdid  say./  had  destroyed  Did  pot  you  tell  Colonel  Hamilton  that  Sou  had  sbewu  llajor  Tanyn  another  note?  A.  I  could  not,  because  I  had  not  ano anotlher...-Q.  tlher...-Q. anotlher...-Q.  When  did  you  see  this  paper  last  that  you  say  is  mis mislaid  laid mislaid  ?  A.  Five  or  six  days  ag0...-Q.  Where  In  my  own  _  -  that  occasion  ?  A.  Not  Om  I  to  any  heti  y  else  ?  A.  A.  Among  semc  other  THE  NATIONAL  REGISTER.  ~~~_n  .  ,  FEB.  I.  papers  irt-my  When-ilitt  you  hist  put  it  in  your  bureau  with  your  other  papers?  A.  I  believe  five  or  Six  days  ago.  At  last  the  witness  admitted  that  be  bad  searched  the  bureau  without  finding  it.  Q.  By  Sir  S.  Rost  ILLY—What  reason  had  you,  in  your  former  exiamination,  to  refrain  from  making  known  such  a  paper  ?  A.  I  thought  it  a  very  unpleasant  circumstance  What  circum circumstance  stance circumstance  do  you  mean  was  unpleasant  ?  A.  The  whole  business  was  unpleasant,  and  I  wish  I  had  nothing  to  do  with  it.—Q.  When  you  spewed  Colonel  Hamilton  the  note,  did  you  read  it  I  A.  No.--.W  ben  he  took  a  copy  of  it,  did  you  read  it?  A.  No.  Q.  How  did  you  describe  it  to  Colonel  Hamilton  ?  A.  I  told  him  I  bad  a  note  respecting  Captain  Tonyn's  promotion.---Q.  Did  you  say  by  whom  it  was  written,  or  if  it  was  in  the  Duke  of  York's  handwriting?  A.  I  never  saw  his  Royal  Highness's  hand-writing.  Oa  being  further  pressed,  he  said  he  never  said  so.  The  witness  having  evidently  prevaricated,  and  appearing  to  be  reduced  to  considerable  embarrassment,  The  SPEAKER  rose,  and  having  moved  that  the  witness  with withdraw,  draw, withdraw,  observed,  that  there  was  ouly  one  course  the  Committee)  could,  ou  this  occasion,  pursue,  which  was  to  tied  the  witness  guilty  of  gross  prevarication  ;  he  therefore  moved,  That  it  is  the  opinion  of  the  Committee  that  the  witness  at  the  Bar  had  been  guilty  of  gross  prevarication  (  !Par  !  hear  !  hich  having  been  unanimously  agreed  to,  he  afterwards  moved,  That  the  House  be  resumed,  and  that  the  said  resolution  be  reported  forth 'forthwith.'  Mr.  Wharton  brought  up  the  Report,  which  was  agreed  to.  The  CHANCELLOR  of  the  EXCHEQUER  rentarked,  that  with  respectto  the  Report  there  could  be  only  one  opinion  in  the  House,  and  moved,  that  Captain  Sandon,  for  the  said  offence,  be  committed-to  the  Serjeant  at  Arms  in  attendance.  The  original  question  having  been  carried  without  opposition,  the  Speaker  gave  instructions  to  the  Serjeant  at  Arms,  to  take  Captain  Huxley  Sandon  into  custody,  and  to  prevent  all  com cominunicatioa.wish  inunicatioa.wish cominunicatioa.wish  the  prisoner.  The  Speaker  then  gave  orders  that  the  Serjeant  do  not  permi  t  any  person  whatever  to  have  access  to  Captain  Sandon.  The  CHANCELLOR  of  the  EXCHEQUER  then  moved,  That  the  Serjeaut  do  forthwith  cause  the  prisoner  to  be  taken  to  his  own  house,  and  search  to  be  there  made  for  a  paper,  in  which  mention  is  made  of  Tonn's  business.  Immediatety  after  this  motion,  the  Serjeant  again  appear(  d,  and  stated,  that  the  priz  , STYLE=superscript  oner  was  desirous  to  return  to  the  IS:ir,  as  having  something  to  submit  to  the  house.  The  CTIA  ttcvLi.o  ti  of  the  BIC  11EQV  utt  thought  it  very  de desirable  sirable desirable  that  the:priioner  should  again  be  called  in,  as  he  should  not  he  surprised  if  the  paper  io  question  were  found,  after  all,  in  his  pwiriess;on.  Captain  Sandon  was  accordingly  brought  to  the  Bar.  The  What  has  the  prisoner  to  suggest  to  the  House  Captain  Minion  then  said,  that  he  was  exceedingly  sorry  if  any  thing  he  had  said  had  displeased  the  House;  and  he  was  willing  to  submit  to  any  censure  the  house  might  inflict.  The  If  the  prisoner  has  any  more  to  offer,  the  House  are  ready  to  hear  Captain  Sandon  said,  the  letter  which  purported  to  be  from  the  i)uke  of  York  to  Mrs.  Clarke  was  not  destroyed;  it  was  in  his  possession  at  his  chambers,  and  if  the  House  required  its  production.  it  could  be  easily  procured.  As  to  the  contents  of  the  letter,  it  went  to  convey  that  Capt.  Tonyo  would  Not  ob obtain  tain obtain  his  preferment  unless  he  paid  a  sum  of  money  to  Mrs.  Clarke.  lie  had  sheaved  this  note  to  Captain  Tonyn,  who,  in  consequence,  agreed  to  the  terms,  was  ('azetted,  and  5001.  paid  to  Mrs.  Clark,  and  231.  to  Donovan.  This  letter  he  was  ready  to  fetch  to  the  House;  he  could  not  say  who  wrote  it;  but  lie  was  told  by  Mrs.  Clarke,  at  the  time  it  was  put  into  his  t  hands,  that  it  was  written  by  the  Duke  of  York.  The  Serjeant  was  ordered  to  do  his  duly,  agreeably  to  the  Re Resolution  solution Resolution  of  the  House.  Mrs.  Clarke  was  again  called  in,  and  examined  by  the  C  IIAN•  CELLOa  of  the  EXCIIEQUER.—Q.  I  wish  to  ask  the  witness,  with  regard  to  the  appointment  of  Captain  Tonyn,  whether  she  recollects  what  passed  between  her  and  Captain  Sandon,  in  consequence  of  Captain  Tonyn  expressing  impatience  at  the  delay  in  procuring  the  appointment  ?  A.  No;  I  really  do  not  recollect,  though  I  have  been  reading  Saudon's  evidence  on  the  subject  just  now.—Q.  Do  you  not  recollect  Captain  Sandon's  coming  to  you  at  all  on  the  subject  ?  A.  I  re recollect  collect recollect  he  was  employed  by  •  Captain  Touyn.—Q.  Do  you  re recollect  collect recollect  Sandon's  mentioning  Captain  Tonyn's  impatience?  A.  Mo.  Ido  not.—Q.  Was  it  not  said  that  Captain  Tonyn  would  withdraw  the  money  he  had  deposited,  if  the  delay  should  be  contiuued  tA.I  do  not  recollect  such  a  circa  mats  thoupbt.  •  P8_TB00018 --Q.  Did  aav  body  else  see  it  un  thal  •  recollect.-  o  a,  oasloesv  11  to  Q.W.ast?  A.  •  _  4OF  +  .  tv  74  ,  r•  bysc.  7j2  4  40 STYLE=superscript  !ei  f STYLE=superscript  rrt,  .  P8_TB00019 k...  t  , STYLE=superscript  I STYLE=superscript  t  1  1 STYLE=superscript  •  ... ",0002644/1809//0219/0002644_18090219_mets.xml
0022,• ,0002644/1809//0219/0002644_18090219_mets.xml
0023,"THE  NATIONAL  REGISTER.  _  .  .  it  might  be  sa.—Q.  Do  you  recollect  to  have  sent  any  message  to  Tonyn  by  Bandon  ?  A.  It  is  so  long  ago,  that  I  can't  !)er !)erfectly  fectly !)erfectly  recollect.--4  do  not  think  I  did  send  any  letier,  but  I  will  net  speik  positively--Q.  As  you  say  you  wery  .o  cautious  in  putting  any  papers  out  of  your  hands,  do  you  recollect  sentUng  a  paper  to  Caplan)  Tonyn  by  the  hands  of  San Sandon  don Sandon  ?  A.  If  you  mean  to  insinuate  it  wa;  the  Duke  of  York's  letter,  I  never  did.—Q.  Are  you  certain  you  never  put  atm  paper  into  Sandon's  hands,  purporting  to  he  a  letter  from  the  Duke  of  York  ?  A.  lam  certain  of  it,  except  lately,  and  once  or  a'former  oetasion  to  Mr.  Manners.---Q.  Did  you  ever  receive  any  note  from  the  'Duke  on  the  subject  of  Capt.  Tonyn's  promo promotion  tion promotion  ?  A.  I  saw  his  Royal  Highness  every  day  ;  there  was  no  occasion  for  notes  passing  between  us  except  when  he  was  iu  the  country.  I  did  nut  receive  any  nob;  on  that  sithject  from  the  Duke.--Q.  You  stated  that  you  had  given  letters  to  Mr.  Manners,  were  these  in  the  hand-writing  of  the  Duke?  A.  'Phey  were---Q.  In  a  former  answer,  you  spoke  as  to  a  supposed  insinuation  that  the  paper  was  a  letter  !rani  the  Duke  of  York  ?  how  came  it  to  occur  to  you  that  sm  . STYLE=superscript  y  each  thing  should  have  •  been  insinuated  as  laving  been  given  by  .  you  to  Captain  Stmdon  ?  A.  I  don't  think  It  ts,  I  am  almost  sure  It  is  not  ;  perhaps  be  may  have  written  such  a  letter  himself-42.  What  interest  had  Sandon  in  the  w wren  ren wren  of  thisaegodatioti  with  Captain  Tonyn.  I  mean  pecuniary  peat,  per  centage,  or  any  thing  of  that  kind  ?  A.  1  believe  he  was  to  have  some  pecatatary  advantage,  though  1  don't  know  what  it  was.  Mr.  Brit);  who  keeps  Slalghter's  Coffee-house,  was  then  called  in  ;  Upon  Which  Mrs.  Clarke  begr,ed  to  be  permitted  to  withdraw,  asking  if  the  Committee  couli  examine  two  witnesses  at  the  same  time.  This  request  was  not,  however,  complied  with,  and  the  CilANcst.t.on.of  the  Elcasquen  rose  to  ask,  Dots  Mr.  Reid  - STYLE=superscript  know  the  witness  at  the  bar  Q.  Did  she  come  •  to  Your  house  under  the  name  of  nowler  ?  A.  Yes.—(Mrs.  Clarke,  I  never  passed  myself  under  that  name,  whatever  this  man  might  think  prorr  to  call  Did  you  address  her  asi‘lrs.  Dowler?  A.  I  always  _spoke  of  her  as  Mrs.  Dowler.  Q.  Did  she  answer  to  that  address  ?  A.  I  understood  so.  By  mr.  BARING.—Q.  Did  you  believe  her  to  be  married  to  7.%tr.  Dowler?  A.  I  never  doubted  it.—Q.  Would  you  not  have  heen  afraid  of  admitting  her  if  you  thought  she  was  not  Mrs.  Dow.ler  ?  A.  Good  God  !  I  should  not  have  thought  of  any  thing  of  the  kind.—Q.  By  whom  was  she  called  Mrs.  Dowler?  A.  Every  person  that  asked  for  her  called  her  By  whom  did  you  understand  her  to  be  so  ?  A.  By  Mr.  Dowler  himself  calling  her  so.  Mr.  BERESVORD  wished  to  put  a  few  questions  to  an  Ho Hopourable  pourable Hopourable  Member  (Mr.  Wardle).---Q.  Tins  the  Honourable  Gentleman  laid  - STYLE=superscript  upon  the  table  of  the  Committee  all  the  Corres Correspondence  pondence Correspondence  that  passed  between  him  and  Mrs.  Clarke  ?  A.  Cer Certainly  tainly Certainly  not-..Q.  Have  you  any  objection  to  produce  it  ?  A.  As Assuredly  suredly Assuredly  I  have—Q.  Has  the  Honourable  Gentleman  any  objec objection  tion objection  to  lay  all  the  papers  before  the  Committee  w  bich  he  took  from  Mrs.  Clarke  ?  A  .  They  are  all  on  the  table  already.  Some  time  after  the  Serjeant  returned  with  Captain  H.  Sandon,  who  was  immediately  called  to  the  Bar,  and  produced  several  papers.  Interrogated  by  the  CrlANcrtmsa  of  the  EXCIXEQUER.---  Q..  Have  you  found  the  paper  ?  A.  I  have.---Q.  W  here  did  the  witness  find  it  ?  A.  In  my  bureau.--Q.  What  are  the  other  papers  ?  A.  Two  letters,  which  . STYLE=superscript  1  had  from  Mrs.  Clark..  Ilere  the  witness  was  ordered  to  look  at  one  of  the  letters—Q.  Did  that  paper  come  from  Mrs.  Clarke.?  A.  Yes—Q..  Did  you  take  it  from  her  hands  ?-.A.  I  did..  The  letter  was  then  read  at  the  table:  It  was  addressed  to  G.  Farquhar,  and  stated  as  'follows  I  have  just  received  your  note,  and  God  bless  KftS.  CIA  RXE  EXAM  iNcu.  121  A  letter  was  put  into  her  hands.  Questioned  by  the  C  AN..  CEl.l.ort  of  Ole  Emelt  1:u1:11.---Q.  Do  you  recollect  having  wen  that  letter  before  ?  Ido  not  recollect  having  seen  it.  Q.  Joe:  the  witness  recollect  having  seen  a  letter  to  Captain  Stan Standen  den Standen  on  the  st:!ject  or  Major  Tonyn's  promotion?  A.  No,  Ido  not  recollect  gis  ing  a  letter,  'sot  I  think  I.  must  have  made  some  comonanieation  on  that  subject—Q.  Does  the  witness  always  write  the  same  hood  ?  A.  1  can't  really  say  how  l  write.  I  generally  write  in  a  hurry.  (Two  bills  produced.)  Q.  Did  you  write  these  bills  ?  One  of  them  was  written  by  my  mo.  titer  ;  I  guided  her  hand.  Q.  Witness  then  means  to  'ay  her  mother  held  the  pen  when  she  wrote  one  of  the  bills  ?  A.  Yea.,  that  was  the  general  way  :  1  had  authority  to  draw  hills  this  way  in  my  mother's  mate.  Q.  Did  witness  write  those  bills  produced  ?  A.  I  wrote  one,  but  cannot  say  which.  If  'I  had  thought  I  had  been  doing  wrong,  I  should  have  burnt  the  hills---Q.  Did  Mrs.  Clarke  ever  imitate  the  hand-writing  of  any  person  ?  A.  I  never  made  a  good  imitation  ;  l  have  en endeavoured,  deavoured, endeavoured,  among  friends,  to  imitate  writing.  I  have  at  times  tried  to  write  like  the  Duke  of  York---Q.  In  point  of  fact,  when  you  did  attempt  to  imitate,  did  you  succeed  ?  A.  I  do  not  know,  the  Duke  of  York  fancied  that  his  writing  was  like  it.  The  only  question  i,  whether  I  did  imitate  the  Duke's  hand,  and  I  am  not  certain  that  I  did  not---Q.  Did  you  ever  imitate  any  other  person's  hand  in  the  presence  Of  wer  ?  A.  I  never  did.  Here  the  letter  addressed  to  G.  Farquhar  was  shewn  the  witness.  Q.  Do  you  know  in  whosc  band-writing  that  letter  is?  A.  It  appears  to  he  in  the  Duke's---Q.  Do  you  not  recollect  having.  received  that  letter  from  the  Duke  of  York  ?  A.  I  never  re received  ceived received  that  letter  fron.  the  Duke,  or  any  other  in  the  name  of  G.  Farquhar----Q.  Do  you  recollect  any  application  to  his  Royal  Highness  which  could  have  given  occasion  to  his  writing  such  a  letter  as  this,  which  sayi--- ",0002644/1809//0219/0002644_18090219_mets.xml
0024,"'would  now  ask  Capt.  Sandon,  whether  Col.  Hamilton  did  not  .give  him  the  advise  he  bad  stated  he  had  before  given  him  in  the  street  near  the.  British  Cofee-house  ?  A.  He  did,  when  we  were  walking  up  the  street---Q.  Are  the  •pavers  on  the  sub subject  ject subject  of  Major  Tonyn?  A.  Yes.  -Questioned  by  Mr.  W.  W.  W  V  I%IN  r—Q.  Were  you  directed  by-  any  person  to  correct  the  letter  you  have  how  produced  ?  A.  I  was  not-.Q.  What  motive  - STYLE=superscript  had  you  for  concealing  it?  1  4 STYLE=superscript  1O•motive  whatever.  •  By  General  LoPTvs...Q.  Is  the  witness  acquainted  with  the  hand-writing  of  Mrs.  Clarke  ?  A.  It  does  not  appear  like  ber  writing..  Q.  Have  you  communieuttd  with  any  person  on  the  seilject  of  that  letter?  A.  Never.  '  no  within  'meant/mid  to  stichttow  s  io  muty'  of  rho  Ser.  s4  o STYLE=superscript  4.th  •  •  ,  4 STYLE=superscript  11  , STYLE=superscript  •  •  •ti ",0002644/1809//0219/0002644_18090219_mets.xml
0025,"I  just  received  your  note,  Ni,,4.  I  recollect  nothing  about  it---Q.  Can  you  not  conjec conjecture  ture conjecture  to  what  it  alludes  ?  A.  No,  I  cannot.  Captain  San4ion  must  have  taken  it  out  of  my  house  without  my  permission  if  it  ever  was  there,  The  CHANCELLOR  of  the  Excti  EQUER  observed,  that  al al.  . al.  .  though  Captain  Sandon's  offence  hail  been  -considerably  miti mitigated  gated mitigated  by  the  production  of  the  paper,  let  it  was  absolutely  necessary  that  he  Should  undergo  some  patishment  for  the  gross  prevarication  of  which  he  had  been  guilty.  Ile  therefote  moved  that  Captain  Huxley  Sandon  be  committed  to  Newgate,  and  that  the  Speaker  do  issue  his  warrant  accordingly;  which  was  agreed  to  ram.  con.  Adjourned.  Friday,  February  17.  EMBEZZLEMENT.  Sir  JOHN  NEWPORT  rose  to  move  for  leave  to  bring  in  a  Bill  for  making  the  Embezzlement  of  Public  Money  a  Felony,  without  bedetit  of  Clergy.  The  object  of  this  Bill  extends  the  operations  of  the  old  act  to  persons  high  in  office,  where  su superior  perior superior  situations  and  emoluments  aggravated  the  nature  of  their  eritne,  Leave  was  given  to  bring  lathe  Bill.  DUKE  OF  YORK.  Colonel  Gordon  examined  by  the  CH  A  NCELLOR  of  the  Ex-  CHEQUER.--Q.  Are  you  acquainted  with  the  hand-writing  of  the  Duke  of  York?  A.  Yes,  perfectly.—Q.  Examine  those  notes  (a  number  of  letters  being;  given  to  him),  and  state  if  they  are  of  the  Duke's  writing?  A.  They  very  nearly,  indeed  almwt  exactly,  resemble  his  hand-writing,  but  I  cannot  positively  say  that  they  are.  General  Itrownrig  called.—Q.  Are  you  acquainted  with  the  Duke  of  York's  hand-writing?  A.  Yes.—Q.  Look  at  those  notes  (letters  put  into  his  hands).  A.  They  are  certainly  very  like,  and  I  should  think  they  are  his  hand,  with  the  exception  of  the  address,  which,  on  some  of  these  letters,  is  not  in  his  hand-writing,.—Q.  Would  you  obey  any  order  given  in  this  hand-writing  ?  A.  I  think  1  should,  the  resemblance  .  being  so  strong,  and  if  I.  had  no  cause  of  suspicion  to  the  contrary.  Mr.  Dickney  was  then  called  in  and  examined.—Q.  Are  on  a  clerk  in  the  house  of  Messrs.  Coons  and  Co.  hankers  ?-7-A.  Yes---Q.  Have_  you  ever.seeu  the  Duke  of  York  write?  A.  I.  haVe  seen  him  sign  his  name  many  times---Q.  Do  you  think  yourself  sufficiently  acquainted  with  his  Royal  Highness's  hand hand'  ' hand'  writiiig,  as  to  be  able  to  say  that  shotl  r  iOte,  is  kti  the  Duke's ",0002644/1809//0219/0002644_18090219_mets.xml
0026,FEB.  19.  P9_TB00021 '7  P9_TB00022 r$  ‘4).  P9_TB00023 1  P9_TB00024 •  P9_TB00025 I  P9_TB00026 ■  P9_TB00027 I ,0002644/1809//0219/0002644_18090219_mets.xml
