art,text,issue_name
0002,"THE  NATIONAL  REGISTER.  114  the  charges  against  him  are  well-founded.  tint  the  exan,s  ple  of  so  illustrious  a  personage,  and  so  nearly  allied  to  tilt•  throne,  arraigned  at  the  bar-of  his  country,  will  el:wince  the  nations  of  - STYLE=superscript  the  world  of  the  impartiality  of  our  laws,  of  the  practical  excellency  of  our  institutions.  With  what  admiration  will  Europe  read  the  proceedings  of  the  present  House  of  Commons  !  There  is  not  an  honest  man,  from  the  banks  of  the  Wolga  to  the  Streights  of  Gibraltar,  who  will  not  say,  an  assembly  is  worthy  of  a  free  peo people,  ple, people,  and  if  other  nations  possessed  similar  tribunals  to  re•  strain  the  vices  of  their  Generals  and  Ministers,  they  would  not  now  writhe  under  the  odious  despotism  of  Bonaparte  and  the  galling  exactions  of  his  .  These  are  our  motives  fur  glorying  in  the  investigation.  It  is  so  cheering  a  reflection  to  think  one's  country  stands  •  high  in  the  estimation  of  other  states;  and  the  idea  is  still  .  more  exhileratinv  s  .  to  know  that  it  deserves  it..  The  charges  against  his  Royal  Highness  accuse  him  of  having  made  the  most  unjustifiable  use  of  his  influence  as  Commander  in  Chief;  and  they  are  supported  by  the  corroborating  evi evidence  dence evidence  of  several  witnesses.  And  for  what  purpose,  and  for  'whom,  is  he  said  to  have  violated  the  duties  of  his  of office  fice office  ?  Good  God  !  we  would  blush  to  mention  it.  A  Prince  et  the  blood,  the  Commander  in  Chief  of  the  Army,  in  rank  the  third  person  in  the  British  empire,  basking  iii  the  favour,  and  living  on  the  smiles  of  a  *****.  For  shame  !  for  shame!  we  can  never  believe  it.  The  idea  is  too  extravagant.  The  letters  arc  unquestionably  fictitious.  Absent  on  the  exercise  of  his  professional  duties,  his  mind  impressed  with  the  important  services  the  troops  he  was  reviewing.,  might  be,  from  day  to  day,  called  to  perform  in  defence  of  their  very  homes—he  could  find  leisure,  or  have  the  inanity  of  fteling,  to  write  these  nauseous  ex expressions  pressions expressions  of  love,  admiration,  and  eternal  constancy  !  'There  is  no  (haste  zephyr  would  waft  such  sighs;  there  is  no  soldier  would  breathe  them  for  such  an  object.—  Dear!  dear  !  Dear  what  dear  !  what  can  the,mat the,matter  ter the,matter  be  ?  True,  something  must  be  the  matter  with  the  head  and  heart  of  the  prince,  or  the  man,  who  could  write  in  that  nauseous  strain,  and  on  such  an  occasion,  to  the  intimate  friend  of  Mr.  I)owler,  and  the  associate  of  Donovan.  In  point  of  composition,  pathos,  and  delicacy  gdfeelilg,  these  letters  are  near  akin  to  the  Corporal's  love  epistle  which  Lefevre  brought  Sterne  when  in  Paris,  as  the  model  of  an  elegant  note  to  Madame  B  .  .  .  and  for  pomposity  and  ardour,  would  cut  no  indifferent  figure  in  the  grand  burlesque  of  n  n  Thumb.  The  Courier  says  the  Duke  of  York  must  be  brought  to  trial.  Unquestionably  he  must.  The  charges  are  too  grave,  too  positive,  to  admit  of  an  alternative.  No  power  upon  earth  can  now  acquit  him  in  any  other  mode,  though  we  wish  the  laws  of  his  country  and  his  conscience  may.  It  would  be  the  most  cruel  injustice,  and  an  act  of  the  most  barbarous  outnige  against  the  accusf'd,  were  thevoceed thevoceedins  ins thevoceedins  to  terminate  without  the  forina:i'  v  of  a  trial.  Shall  the  Duke  of  York  be  deprived  of  the  b  , STYLE=superscript  :nefit  of  those  laws  Ivhich  is  granted  to  the  most  fla!;itiowz  culprit?  Shall  an  impression  go  abroad  that  favour  or  power  screened  him  horn  censure,  for  the  gross  offences  which  arc  imputed  to  him?  Shall  his  character  he  left  naked  and  defenceless  to  •  the  poisoned  shafts  -of  malignity,  to  the  random  shot  of  ,indiscretion  !  The  men  who  would  advise  it  are  no  friends  to  his  Royal  nor  to  their  country,  and  are  un unaitiestionably  aitiestionably unaitiestionably  none  to  the  Douse  of  Brunswick.  •  A  trial  must,  therefor  - STYLE=superscript  e,  be  instituted,  to  rescue  the  accused  •from  groundless  suspicion,  and  to  avoid  the  painful  consequences  4ofpelilibn  on  the  part  of  the  country  !  Shall  calumny  rear  lier.crested  head,  and  boldly  and  openly  stalk  from  county  to  county,  casting  about  torches  of  discord,  spreading  disaffection,  and  underminino..  the  attachment  of  the  public  •to  the  present  establishment.  The  men  who  would  advise  any  other  mode  of  proceeding  are  the  real  Jacobins,  arc  -conspirators  against  the  throne  and  the  people.  An  intimation,  it  is  said,  has.  been  given  from  a  ccrlain  quarter,  to  certain  persons  high  in  office,  to  interfere  more  pointedly  and  decidedly  in  the  pending  investigation.  A  •stiore  pernicious  ciercise  of  authority,  or  11101  V  fatal  to  FEB.  10.  the  tranquillity  of  the  country,  or  more  detrimental  to  the  interests  of  the  Commander  in  Chic),  could  not  have  been  -suggested.  We,  therefore,  reject  this  rumour,  as  conveying  an  unjustifiable  opinion  of  a  personage  we  are  in  the  habit  of  revering,  and  implying  an  uaconstitutioual  influence  where  it  should  not,  and  o  .ght  not,  to  be  exerted.  His  Royal  Highness  must  be  brought  to  trial  ;  anu  any  man,  who  opposes  it  in  this  awful  crisis  of  our  affairs,  is  a  dangerous  egotist,  indifferent  to  the  houodr  or  existence  of  the  empire.  This  impartiality  will  silence  secret  murmurs,  and  stifle  discontent,  which  would  brood  in  private  over  the  supposed  injustice.  This  is  no  fit  season  for  trying  the  dangerous  experiment  of  relaxing  public  morals,  and  tam tampering  pering tampering  with  the  laws.  The  laws,  said  the  heythian  ANA ANACHARMS,  CHARMS, ANACHARMS,  are  cobwebs,  which  catch  flies,  but  are  broken  by  wasps.  For  God's  sake,  let  not  this  imputation  be  attach attached  ed attached  to  ours,'which  have  excited,  till  now,  the  admiration  of  the  philosopher,  and  the  wonder  of  oilier  nations.  We  ex exult,  ult, exult,  we  repeat  it  once  more,  in  the  present  investigation,  it  is  the  first  step  towards  a  radical  reform,  and  the  axe  is  al already  ready already  laid  at  the  root  of  abuses.  Enough  has  come  out  to  spew  that  they  exist  to  an  alarming  degree  ;  and  hie  pub public  lic public  begin  to  lay  that  servile  and  dangerous  complaisance  aside,  which  arose  out  of  the  excesses  of  the  French  Revo Revolution.  lution. Revolution.  The  applause  bestowed  on  Mr.  WARDLE  for  his  manly  and  patriotic  conduct,  will  create  emulation  ;  and  all  the  recesses  of  venality  will  be  explored  with  a  prying  inquisitorial  eye.  Jobbers,  contractors,  minions,  an,i  mis mistresses  tresses mistresses  may  have  cause  to  complain  of  the  projected  refisrm,  and  cry  down  the  supporters  of  it  as  jacobins  and  conspi conspirators  rators conspirators  ;  but  the  slang  of  these  associates  is  now  intelligible  to  the  public;  and  Jacobin,  in  their  cant  phraseology,  sig signifies  nifies signifies  a  well-  intentioned,  zealous,  and  disinterested  ft:cud  of  the  constitution.  Anether  reason  why  we  feel  an  incli inclination  nation inclination  to  rejoice  at  the  proceedings  of  the  Committee,  is,  that  they  will  enable  the  present  and  future  administra administrations  tions administrations  to  act  with  more  freedom  and  energy.  There  existed  a  fatal  clog  on  the  exertions  of  the  Ministry  of  the  eity,  and  to  that  cause  we  may,  perhaps,  attribute  the  disasters  of  the  Spaniards;  and  our  own  late  reverses  ;led  disgrace.  What  they  projected,  and  wished  to  be  carried  into  execu execution,  tion, execution,  was  marred  by  the  jealousy  and  disaprointed  ambi ambition  tion ambition  of  a  single  individual.  Fired  with  an  inordinate  desire  to  conduct  a  numerous  army  into  Spain,  and  suffering  the  mortification  of  having  his  wishes  frustrated  by  the  decided  opposition  of  the  public,  and  the  independent  part  of  the  Ministry,  (their  names  are  su  ffi  ciently  known),  he  felt,  we  are  afraid,  too  strong  an  inclination  to  prefer  his  resent resentments  ments resentments  to  the  interests  as  well  as  honour  of  the  Common Commonwealth.  wealth. Commonwealth.  The  courier  of  Friday  last  contains  a  report  that  the  office  of  Commander  iu  Chief  will  be  immediately  put  in  commission,  in  the  same  manner  as  the  Office  of  Lord  High  Admiral  has  been  since  the  reign  of  Queen  ANNE.  We  sincerely  and  ardently  wish  this  report  were  trek  ;  for  then,  and  only  then,  can  we  look  to  the  same  brilliant  services  from  the  army,  as  from  the  navy.  Whatever  the  talents  of  the  present  Commander  in  Chief  arc,  however  great  his  activity  and  assiduity  may  be,  nobody  will  deny  but  his  talents  and  exertions  are  inadequate  to  the  complete  per performance  formance performance  of  the  great  duties  which  the  vast  increase  of  our  military  force  imposes  on  film.  Ile  may  possess  all  the  genius  and  discernment  of  a  TiLtaLtionorGa,  with  the  ad administrative.  ministrative. administrative.  talents  of  a  CARNOT,  and  he  still  singly  incapable  of  the  discharge  of  all  the  duties  annexed  to  this  important:  office.  It.  is  too  much,  and  too  complicated,  for  the  exertions.of  one  person,  and  requires  a  mass  and  variety  of  talents  and  knowledge,  to  give  it  th4t  vigour,  life,  and  perfection,  which  our  Navy  go  incomparably  pos possesses.  sesses. possesses.  The  British  Navy  !—There  is  not  an  Englishman,  Whose  heart  does  not  exult  at  the  very  name  I  It  conveys  the  image  of  victory  and  safety,  unblemished  by  a  single  reverse.  But  our  army,  though  compostd  of  the  same  mettle,  and  equally  - STYLE=superscript  brave,  from  Some  mismanagement,  or  latent  defect  in  its  erganisation,  or  incapacity  of  the  Com Commander  mander Commander  in  Chief,  has  frequently  disapp  'ted  the  lw-  of  the  country.  I  P2_TB00010 ppoitited  the  hopes  of  Pi  P2_TB00011 v ",0002644/1809//0219/0002644_18090219_mets.xml
0004,"THE  NATIONAL  REGISTER.  FEB.  I  FOREIGN  INTELLIGENCE.  TIIE  THIRTY-FIRST  BULLETIN  OF  THE  ARMY  OF  SPAIN.  The  English  regiments  bearing  the  numbers  42,  50,  and  52,  have  been  entirely  destroyed  in  the  battle  of  the  16th,  near  Co Coimam.  imam. Coimam.  Not  60  men  of  each  of  these  corps  embarked.  The  Ge Geacrid  acrid Geacrid  in  Chief,  Moore,  has  been  killed  in  attempting  to  charge  at  the  head  of  this  brigade,  with  the  view  of  restoring  the  fortune  of  the  day.  Fruitless  efforts.  This  troop  was  dispersed,  and  its  General  slain  in  the  midst  of  it.  General  3aaird  had  been  already  Wounded.  lie  passed  through  Corunna  to  get  on  hoard  his  ;:hip,  and  did  not  get  his  wound  dressed  till  he  got  on  hoard  ;  it  is  re reported  ported reported  that  he  died  on  the  19th.  After  the  battle  of  the  16th,  a  dreadful  night  passed  at  Corunna.—The  English  entered  in  confu confusion  sion confusion  and  consternation.  The  English  army  had  landed  more  than  BO  pieces  of  cannon  ;  only  12  were STYLE=superscript  re-embarked  :  the  remainder  has  been  taken  or  lost  ;  and  by  a  return  made,  we  find  ourselves  in  possession  of  60  pieces  of  English  cannon.  Independent  or  two  millions  of  treasure  the  army  has  taken  from  the  English,  it  appears  that  a  treasure  inure  considerable  has  been  cast  away  among  the  rocks  and  precipices  which  border  the  road  from  A•i A•i-torga  torga A•i-torga  to  Corunna.  The  peasants  and  the  soldiers  have  ccallected  a  great  quantity  of  silver  among  the  rocks.  In  the  engagements  'which  took  place  during  the  retreat,  and  prior  to  the  battle  of  Corunna,  two  English  Generals  were  killed,  and  three  wounded.  General  Crawford  is  named  among  the  last.  The  English  have  lost  every  thing  that  constitutes  an  army—Generals,  artillery,  horses,  baggage,  ammunition,  magazines.  On  the  17th,  at  day daybreak,  break, daybreak,  we  were  masters  of  the  heights  that  command  the  road  to  Corunna,  and  the  batteries  were  playing  upon  the  English  con convoy.  voy. convoy.  The  result  was,  that  many  of  the  ships  were  unable  to  get  out,  and  were  taken  at  the  capitulation  of  Corunna.  Five  hun hundred  dred hundred  English  horses  were  also  taken  still  alive,  16,000  muskets,  and  a  great  deal  of  battering  cannon,  abandoned  by  the  enemy.  A  great  number  of  magazines  are  full  of  preserved  provisions  (munition  confectiones),  which  the  English  wished  to  carry  oil,  but  were  obliged  to  leave  behind.  A  powder  magazine,  contain containing  ing containing  200,0001b5.  weight  of  powder,  has  also  fallen  into  our  hands.  The  English,  surprised  by  the  issue  of  the  battle  of  the  16th,  have  not  even  had  time  to  destroy  their  magazines.  There  were  300  English  sick  in  the  Hospital.  We  found  in  the  port  seven  English  ships—three  loaded  with  horses,  and  four  with  troops.  They  could  not  get  out.  The  fortress  of  Corunna  is  of  an  e  xtent  which  secures  it  from  a  coup  de  main.  It  was  therefore  impossible  to  enter  it  before  the  20th,  in  virtue  of  the  annexed  capitulation.  In  Corunna  we  found  above  200  pieces  of  Spanish  cannon.  The  French  Consul  Fourcroy,  the  General  Ouesnel,  and  his  Staff;  M.  Bougars,  Officer  of  Ordnance;  M.  Taboureau,  Auditor;  and  3.50  French  soldiers  or  seamen,  who  had  been  made  prisoners  either  in  Portugal  or  on  board  the  ship  Atlas,  have  been  delivered  up.  They  express  great  Satisfaction  at  the  conduct  of  the  Officers  of  the  Spanish  Navy.  The  English  will  have  gained  by  their  expedition  the  hatred  of  the  Spaniards,  shame,  and  dishonour.  The  flower  of  their  army,  composed  of  Scotchmen,  has  been  either  wounded,  killed,  or  taken.  General  Franceschi  has  entered  St.  Jago  de  Compostella,  where  he  found  some  magazines  and  an  English  guard,  which  he  took.  He  marched  immediately  upon  Vigo,  Romana  appeared  to  Nave  taken  this  route  with  2500  men,  all  that  he  could  rally.  The  divkion  of  Mermet  marched  on  Verrol.  The  air  about  Corunna  is  infected  by  the  carcases  of  1200  horses,  whom  the  English  killed  in  the  streets.  The  first  care  of  the  Duke  of  Dalmatia  has  been  to  provide  for  the  restoration  of  salubrity,  equally  important  to  the  soldiers-  and  the  inhabitants.  General  Alzedo,  Governor  of  Corunna,  appears  to  have  taken  part  for  the  insurgents  only  from  the  constraint  of  force.  lle  took  the  oath  of  fidelity  to  King.loseph  Napoleon  with  enthusiasm.  The  people  manifest  the  joy  they  feel  at  being  delivered  from  the  English.  IMPERIAL  PARLIAMENT.  IIOUSE  OF  LORDS.  'Monday,  Feb.  13.  Sir  George  Brograve's  Divorce  Bill  was  read  for  the  firs  time.  Thursday,  Feb.  16.  The  Duke  of  GLOUCESTER,  presented  a  Petition  from  the  Debtors  confined  in  the  King's  Bench  isou,  praying  relief. ",0002644/1809//0219/0002644_18090219_mets.xml
0005,"CAVALRY  SENT  TO  SP4IN,  &amp;C.  Earl  DARN  LEY  moved  fur  Returns  of  the  Cavalry  sent  to  Spain  and  Portugal.  His  Lordship  said  the  object  of  t.is  motion  was,  to  discover  whether  Ministers  had  sent  a  proper  proportion  of  cavalry  on  the  late  service  in  Spain  and  Portugal.  Nolue  Earl  concluded  by  moving,  first,  Inc  Returns  of  Cavalry  in  England,  Ireland,  and  Scotland  ;  secondly,  for  iteturns  of  the  Cavalry  sent  to  Sir  A.  Welle-dey  at  Vimiera,  and  Sir  J.  Moore,  previous  to  the  junction  of  the  two  armies;  thirdly,  for  Copies  of  the  communications  from  the  Juntas  of•  Spain.  The  Earl  of  Ltv  ER  POO  t,  conceived  that  the  motion  ought  to  be  more  evtensive,  therefore  moved  amendment,  to  include  returns  of  all  cavalry  sent  to  Portugal  Spain,  to  the  end  of  I  titH.  The  motion,  with  the  amendment,  was  carried.  The  Noble  Earl  then  stated,  that  the  instructions  transmitted  to  the  Otlicers  employed  in  the  Expedition  to  Spain,  &amp;c.  should  be  laid  before  tile  Iluuse.—Adjourned.  Frir;try,  ORDERS  IS  COUNCIL.  Lord  GRENVILLE  rose  to  make  his  promised  motion.  It  would,  be  said,  be  in  their  Lordships  recollection,  that  in  con consequence  sequence consequence  of  the  sentiments  felt  and  expressed  by  every  clas  of  merchants  and  manufacturers  in  this  kilidaMl,  he  had,  on  a  former  occasion,  distinctly  ..,o1  fully  stated  his  opinions  and  his  argu arguments  ments arguments  upon  the  question,  which  this  night  his  duty  galled  up  o  n  him  again  to  bring  before  their  Lordships-1  question  involvi  n  g  not  merely  the  commercial  and  fiaancial  interests,  but  the  politi political  cal political  and  moral  justice,  nay,  in  its  ultimate  effects,  the  safety,  per perhaps  haps perhaps  the  existence  of  the  Empire.  From  the  authentic  and  printed  documents  upon  their'  Lordships'  table,  he  would  make  it  manifest  to  every  Noble  Lord  who  heard  him,  that,  so  far  from  unfairness,  or  partiality,  exhibited  on  the  part  of  America  against  this  country,  and  in  favour  of  France,  nothing  could  pos possibly  sibly possibly  be  more  fair  or  impartial,  excep:,  imleed,  w  hat  his  Lord Lordship  ship Lordship  maintained  was  truly  the  case,  a  partiality,  and  a  very  im important  portant important  one,  in  favour  of  this  country.  Here  his  Lordship  read  the  instructions  sent  by  the  American  Government  to  Mr.  Armstrong  in  Paris,  :LA  to  Mr.  Pinckney  in  London,  whereby  it  appeared  that  the  proposal  to  this  Govern Government  ment Government  was  that,  on  the  part  of  America,  the  Embargo  should  he  suspended,  provided  we  would  reseiud  the  Orders  in  Council;  and  this  being  agreed  upon,  it  was  added,  that  she)  mid  France  refuse  to  cancel  her  decrees,  she  must  necessarily  draw  upon  herself  the  hostility  of  America.  The  same  proposition,  and  in  the  same  terms,  was  made  to  the  Government  of  France;  so  that  here  was  a  fair  opportunity  of  not  only  conciliating  the  American  States,  and  restoring  the  good  understanding,  and  the  solid  advantages  from  it  resulting  to  both  countries,  but  a  strong  probability  was  afforded  of  a  cordial  and  ;:etive  co-operation,  by  a  powerful  Ally,  in  prosecuting  war  agaitist  the  common  enemy.  flis  Lordship  reprobated,  in  very  strong  terms,  the  conduct  of  Ministers,  which  appeared  to  have  been  suggested  by  no  motive  of  wisdom,  justice,  or  policy,  but  to  grow  oat  of  a  principle  of  petty  and  despicable  pride.  From  the  Papers  on  the  table,  he  deduced  a  deplorable  falling  oil'  in  the  anuoint  of  Imports  and  Exports  from  and  to  the  American  States  last  year.  With  re respect  spect respect  to  that  most  important  article  corn,  it  was  well  known  to  their  Lordships  and  to  the  world,  that  this  country  did  not  pro produce  duce produce  a  quantity  of  it  at  all  adequate  to  its  own  consumption;  and  now  that  we  were  deprived  of  all  our  former  sources  of  supply  from  the  Northern  ports  of  Europe,  it  became  peculiarly  ne necessary  cessary necessary  to  obtain  it  through  America.  But.  if  Minis:ers,  as  seemed  to  he  their  object,  were  determined  to  force  that  country  into  war  with  us,  what  might  be  the  consequence,  in  this  point  of  view,  it  would  well  becoole  their  Lordships  seriously  to  consider.  Lord  BA  rnuRST  expressed  a  readiness  to  begin  A  negotiation  with  America,  as  soon  as  that  country  would  oder  ti:rms  which  it  was  consonant  r.ith  the  dignity  of  Great  Britain  to  accept.  It  had  been  stated  by  the  Noble  Mover,  that  the  intention  of  the  duties  imposed  by  the  Orders  in  C.:ancil  on  foreign  trade,  was  to  increase  the  public  1....-satie  of  the  S:  .:e.  But  he  (l.;  tared,  that  their  chief  end  was  to  distress  th.s,  foe,  .to  deprive  him,  and  the  nations  that  groaoi'd  1),..•.,'ath  his  despot  ism,vnidttsbmy  tbe  iriv  ,  of  t  s  lins  )  e  iiis  commo commodities  dities commodities  which  they  had  so  1..:!g  eil  s  iO  eel;  a  which  must  be  intolerahle,  to  force  them  to  cry  ai  otid  for  peace.  The  Noble  Lord  was  much  in  the  a'l'ong,  if  he  fancied  that  our  manufactures  had  suffered  so  much  ;  he  Avonld  find,  on  the  con contrary,  trary, contrary,  that  in  ISOtr  there  was  an  iecrease,  in  t'•-.  exports  of  our  ma mai  i mai  nufaetmed  . STYLE=superscript  pods,  of  five  hundred  thousand  pounds.  Lord  Bathurst  then  pointe  r  '  out  several  large  tracts  of  uncultivated  ground  in  Ireland,  where  it  would  he  easy  to  wow  flax,  as  soon  as  the  seed  -  could  be  obtained  from  Lower  Canada;  which,  on  account  of  =  P3_TB00018 1  •  •=-1  t,  •  •  .•  .•  • ",0002644/1809//0219/0002644_18090219_mets.xml
0006,1 ,0002644/1809//0219/0002644_18090219_mets.xml
0007,I  P3_TB00021 115 ,0002644/1809//0219/0002644_18090219_mets.xml
